injury_report,tweet,clean
1,"@Tate_Roberts_ It's baseball, Tate. Other teams have injuries, too. #Cardinals don't even lead the league. Stop using injuries as an excuse, Tate, for ineffectiveness or inactivity in June when they could have added help.  Pretty simple.",TateRoberts Its baseball Tate Other teams injuries Cardinals even lead league Stop using injuries excuse Tate ineffectiveness inactivity June could added help Pretty simple
1,"Former Largo High star Bobby Roundtree, injured in 2019 accident, dies at 23  https://t.co/juZp5BZeDo",Former Largo High star Bobby Roundtree injured accident dies httpstcojuZpBZeDo
1,"@TheJayBaller Showing the injury is completely different than saying, ""here's an inside the park home run"" like nothing else happened on the play.",TheJayBaller Showing injury completely different saying inside park home run like nothing else happened play
1,"@breathehoops that's kinda what he does, same qualities that turned the hawks series in the bucks' favor post-giannis injury.",breathehoops kinda qualities turned hawks series bucks favor postgiannis injury
1,"@Winningugly8 To play second base, I agree with you. Story would be an insurance plan if . . .  You know, I'm not even going to contemplate or put into existence an injury to that player.",Winningugly To play second base I agree Story would insurance plan You know I even going contemplate put existence injury player
1,Trainer came out to check on Chapman but he's staying in.,Trainer came check Chapman staying
1,Up now at Forbes-@Indians are struggling through significant player injuries as they enter the 2nd half. @Indians @WhiteSox @Dodgers @Brewers @Cubs @Padres @Royals @Tigers @Twins    https://t.co/q5Za4amVju,Up ForbesIndians struggling significant player injuries enter nd half Indians WhiteSox Dodgers Brewers Cubs Padres Royals Tigers Twins httpstcoqZaamVju
1,"@KreplineRoland There aren't great options with Kimbrel, Cishek and Kintzler on the IL. Rowan Wick can't pitch every inning and the defense requiring four or six outs didn't help matters last night.",KreplineRoland There great options Kimbrel Cishek Kintzler IL Rowan Wick pitch every inning defense requiring four six outs help matters last night
1,"The #BlueJays have four reliable SPs following the emergence of Stripling/Manoah. But injuries could change that in a hurry and there isn't much depth to work with. Upgrading over Matz might not seem like a priority now, but this team could really use another mid-rotation piece.",The BlueJays four reliable SPs following emergence StriplingManoah But injuries could change hurry much depth work Upgrading Matz might seem like priority team could really use another midrotation piece
1,"Mark Appel’s journey back to the Phillies: Shoulder surgery, a sandwich shop and why he started wearing an A’s hat to Minute Maid Park.  https://t.co/Er7hckKWdw",Mark Appel journey back Phillies Shoulder surgery sandwich shop started wearing A hat Minute Maid Park httpstcoErhckKWdw
1,"The Arizona Diamondbacks retained its ninth position in MLB Pipeline's midseason farm system rankings, but some top prospects are injured.   https://t.co/ahqmlYQXT9",The Arizona Diamondbacks retained ninth position MLB Pipelines midseason farm system rankings top prospects injured httpstcoahqmlYQXT
1,"His attendance in question until Saturday because of a positive covid test a week earlier, Troy Polamalu clearly was the favorite among the pro-Steelers fans that made the two-hour drive from #Pittsburgh to attend the ceremony.    https://t.co/92MmJqDps3",His attendance question Saturday positive covid test week earlier Troy Polamalu clearly favorite among proSteelers fans made twohour drive Pittsburgh attend ceremony httpstcoMmJqDps
1,"Still look back to May 23 when the Mariners fell to 21-26, were without Graveman &amp; Steckenrider due to COVID-19 &amp; the Sunday loss to SD was their 6th straight by a combined score of 46-10.  This team looked like absolute toast.  45-30 with a +10 RD since, including 6 of 10 vs OAK",Still look back May Mariners fell without Graveman amp Steckenrider due COVID amp Sunday loss SD th straight combined score This team looked like absolute toast RD since including vs OAK
1,"@donniekellybaby First, let's hope that both OF'ers don't have to go on the IL.",donniekellybaby First let us hope OFers go IL
1,@kjr_118 @whitesox on the IL,kjr whitesox IL
1,"It used to be you’d watch Carlos Rodón to see his wipeout slider, even when he was diminished by injury.   Now, it’s the fastball that’s truly eye-popping.   https://t.co/mcFSzYwUwd  https://t.co/Dez9KfYCui",It used watch Carlos Rodón see wipeout slider even diminished injury Now fastball truly eyepopping httpstcomcFSzYwUwd httpstcoDezKfYCui
1,Exciting deadline day news in Barcelona: they've finally managed to register their own injured player  https://t.co/EqXbSoUj6E,Exciting deadline day news Barcelona finally managed register injured player httpstcoEqXbSoUjE
1,"Posted-Up-Running...My Website  Best 15 Minutes Sports..Padres lose again to bad club Hacksaw's Headlines..Chargers hit by injuries 1-Man's Opinion Column..""Padres-Help Wanted-Pitching""  Link:  https://t.co/Bv6D9LTR0z",PostedUpRunningMy Website Best Minutes SportsPadres lose bad club Hacksaws HeadlinesChargers hit injuries Mans Opinion ColumnPadresHelp WantedPitching Link httpstcoBvDLTRz
1,"@bearcub712 Kimbrel has a kid with serious medical issues. I think the pitch was they didn't have to get a whole new set of doctors, etc. which would still be true.",bearcub Kimbrel kid serious medical issues I think pitch get whole new set doctors etc would still true
1,"Poor Derek Hill, in a lot of pain after fouling a ball off his foot, has to sprint down the first-base line about 30 seconds later on an infield grounder.   He's coming back out to play center field in the bottom of the inning.",Poor Derek Hill lot pain fouling ball foot sprint firstbase line seconds later infield grounder Hes coming back play center field bottom inning
1,"@CTruck24 Yeah, well, we write about and follow sports here, and this is a major injury to one of the premier athletes in pro sports. Go be cute elsewhere.",CTruck Yeah well write follow sports major injury one premier athletes pro sports Go cute elsewhere
1,"Down 5-7 0-2 to Ka. Pliskova after losing a 4-0 lead, Badosa retires with an injury to her right arm or neck.",Down Ka Pliskova losing lead Badosa retires injury right arm neck
1,Bryce Harper and the Phillies send love to Ronald Acuña Jr. after heartbreaking injury.  From @gfstarr1:  https://t.co/tjLJQeJdq5,Bryce Harper Phillies send love Ronald Acuña Jr heartbreaking injury From gfstarr httpstcotjLJQeJdq
1,"@apoirier717 Nah, I'd be too hot. And I wouldn't want to cause Najee Harris to get injured.",apoirier Nah I would hot And I would want cause Najee Harris get injured
1,Hunter Dozier told @goldbergkc on the Ballys broadcast that the illness he'd been dealing with was food poisoning.,Hunter Dozier told goldbergkc Ballys broadcast illness would dealing food poisoning
1,Having trouble remembering the last time a first round pick in this city was not injured in preseason or before it.,Having trouble remembering last time first round pick city injured preseason
1,"@brockoli90 @ArrowheadAddict No need to pray for the health of everyone's ACL's during a time of year when players get injured? Nah, I'm lighting all the candles for our guys.",brockoli ArrowheadAddict No need pray health everyones ACLs time year players get injured Nah I lighting candles guys
1,@DownToBlack Do you think there is merit to the idea that the league has figured out how to exploit his weaknesses? Or do you fall more on the “injuries were to blame” side of things?,DownToBlack Do think merit idea league figured exploit weaknesses Or fall injuries blame side things
1,"#Padres-#Dodgers series preview: LA has lost five in a row, who's hot/not, pitching probables and injury updates.  https://t.co/PW6lNMFZki  https://t.co/8xLtBVJFG3",PadresDodgers series preview LA lost five row hotnot pitching probables injury updates httpstcoPWlNMFZki httpstcoxLtBVJFG
1,You sure about that? And the two guys above him are injured...  https://t.co/TbvlWWTALl,You sure And two guys injured httpstcoTbvlWWTALl
1,@mikemayer22 @jackramseymmo What sort of professional athlete gets a fatigued left leg? I could understand maybe a hockey or basketball player. But a baseball player???,mikemayer jackramseymmo What sort professional athlete gets fatigued left leg I could understand maybe hockey basketball player But baseball player
1,Bryce Harper is out of the game after getting hit by a deGrom changeup in the top of the sixth. Travis Jankowski now in right field.,Bryce Harper game getting hit deGrom changeup top sixth Travis Jankowski right field
1,"This week from @DBLesky: When the #Royals should call up Bobby Witt Jr., what the defensive alignment should be when he’s up, how do they handle MJ Melendez once he’s up and some frustration with how the team has handled players coming back from injury.  https://t.co/Gz475xMszq  https://t.co/ufE6FGRdcK",This week DBLesky When Royals call Bobby Witt Jr defensive alignment handle MJ Melendez frustration team handled players coming back injury httpstcoGzxMszq httpstcoufEFGRdcK
1,@JATayler injuries suck,JATayler injuries suck
1,@iowaneck Outrighting an injured player during the season is not allowed.,iowaneck Outrighting injured player season allowed
1,"@BMatt55 @FitzGSN_ Can’t remember, Bob, was taking a knee their last possession?  Not sure if they event touched the ball in OT.",BMatt FitzGSN Can remember Bob taking knee last possession Not sure event touched ball OT
1,"Quintin Torres-Costa was on the verge of reaching the big leagues back in 2018, but since returning from Tommy John surgery, he has issued 51 walks over 49 IP at various professional levels. Unfortunate turn of events for a guy who once looked like a potential MLB bullpen piece.",Quintin TorresCosta verge reaching big leagues back since returning Tommy John surgery issued walks IP various professional levels Unfortunate turn events guy looked like potential MLB bullpen piece
1,@CaseyPrattABC7 Horrible flashbacks to Brandon’s injury just now. Hoping for the best for Chris.,CaseyPrattABC Horrible flashbacks Brandon injury Hoping best Chris
1,"This is the truth. It’s also an important reminder that even in circumstances unlike Hill’s, who was injured a lot early on, development is not linear and oftentimes offensive impact is the final thing to come for players. Plus, he’s still the best prep OF defender I’ve ever seen",This truth It also important reminder even circumstances unlike Hill injured lot early development linear oftentimes offensive impact final thing come players Plus still best prep OF defender I ever seen
1,@JGoldberg12 I'd think leaving a pitcher in a game after he 'feels a pinch in his shoulder' would be the stupidest thing in baseball,JGoldberg I would think leaving pitcher game feels pinch shoulder would stupidest thing baseball
1,"""I've never lost a patient from this diagnosis, ever,"" Dr. Hasan Kakli said.  https://t.co/UuCE75GtR5",I never lost patient diagnosis ever Dr Hasan Kakli said httpstcoUuCEGtR
1,@mooseg417 It was super fun and it felt really damn good to be back out there. My body is definitely sore today lol.,mooseg It super fun felt really damn good back My body definitely sore today lol
1,"Connor Joe said he's giving his first home run ball to his wife, who was the one that reminded him last night that today was the one-year anniversary of being declared cancer free. It's a day he said he'll remember forever.   ""I can't explain all the emotions,"" he said.",Connor Joe said giving first home run ball wife one reminded last night today oneyear anniversary declared cancer free Its day said remember forever I explain emotions said
1,"After cart got to the walkway by the dugout that leads to clubhouse, Acuña had to be carried off the cart and up the hallway.",After cart got walkway dugout leads clubhouse Acuña carried cart hallway
1,"Please join Niswonger Children's Hospital for Kid's Central at Kingsport Fun Fest! This event is FREE to the community. Kids Central is a wonderful way for the entire family to have fun while learning the importance of health, wellness and injury prevention. #WhereHopeRises  https://t.co/g57ZBcSgPs",Please join Niswonger Childrens Hospital Kids Central Kingsport Fun Fest This event FREE community Kids Central wonderful way entire family fun learning importance health wellness injury prevention WhereHopeRises httpstcogZBcSgPs
1,@pinkstonaa I think Tepera will only not be traded if teams are worried about him regaining his pre-IL form. His velocity was down last time out. But he's a free agent that turns 34 in November... I'd think they would like to get a solid prospect for him if possible.,pinkstonaa I think Tepera traded teams worried regaining preIL form His velocity last time But free agent turns November I would think would like get solid prospect possible
1,Oh come on. Lorenzen getting hurt there was a fluke thing. I am pretty sure he has never got hurt on the offensive side of the ball in his career.,Oh come Lorenzen getting hurt fluke thing I pretty sure never got hurt offensive side ball career
1,"COVID-19 has wreaked havoc on Yankees, Phillies rosters  https://t.co/kei0iEGMdd  https://t.co/r4sRLbkqX6",COVID wreaked havoc Yankees Phillies rosters httpstcokeiiEGMdd httpstcorsRLbkqX
1,Kyle Gibson had allowed runs in just one of 17 innings since returning from the IL before Gurriel’s sac fly in the 6th.,Kyle Gibson allowed runs one innings since returning IL Gurriel sac fly th
1,"I see a lot of #Mets fans continually whinging about the number of injuries the team has suffered from this season. It's bizarre. Of all fan bases, they should know full well this is a part of sport and impacts every team. I mean, they've seen what's happened across town, yeah?",I see lot Mets fans continually whinging number injuries team suffered season Its bizarre Of fan bases know full well part sport impacts every team I mean seen happened across town yeah
1,@kennewickmike Did you read the stories from last night? He said he wasn't 100 percent and had spent the last two weeks seeing the trainer,kennewickmike Did read stories last night He said percent spent last two weeks seeing trainer
1,@TepidP Had completely forgotten about him until I did a top 30 review and saw his name. Hopefully the bad stretch was injury related. Getting 160-180 adequate innings from him in 22 would be a godsend.,TepidP Had completely forgotten I top review saw name Hopefully bad stretch injury related Getting adequate innings would godsend
1,If the #MNTwins are using the deadline as leverage and trying to sign Buxton to a deal like that while he’s hurt I don’t see much path for a positive outcome and that stinks.,If MNTwins using deadline leverage trying sign Buxton deal like hurt I see much path positive outcome stinks
1,These three #MNTwins players are filling in for injured players.   Can they help the team to turn their record around during a soft part of their schedule?⤵️⤵️⤵️   https://t.co/Z5Bl8pGn9S,These three MNTwins players filling injured players Can help team turn record around soft part httpstcoZBlpGnS
1,The Yankees' COVID outbreak just got worse. Again. Seriously.   https://t.co/h1xk7MQiNW,The Yankees COVID outbreak got worse Again Seriously httpstcohxkMQiNW
1,"Tonight, our guest is @BaseballJeff1 as @ChrisBrown0914, @rogcastbaseball and @Yooper_IA talk Giants baseball, the Tigers winning streak and the latest injury setback to Rogers. Questions or comments? Let us know.",Tonight guest BaseballJeff ChrisBrown rogcastbaseball YooperIA talk Giants baseball Tigers winning streak latest injury setback Rogers Questions comments Let us know
1,"@MillManner Honestly, I’ll give them an A. Do they deserve an A for playing A caliber baseball all the time? No. But, they had an obscene amount of injuries and the “next man up” mentality kept them in 1st place. Pretty amazing in my opinion #LGM",MillManner Honestly I give A Do deserve A playing A caliber baseball time No But obscene amount injuries next man mentality kept st place Pretty amazing opinion LGM
1,When announcers say a guy who never played in the league is going to average 28 points someday my eyes just roll so hard I may need surgery now.   Definitely considering a lawsuit.,When announcers say guy never played league going average points someday eyes roll hard I may need surgery Definitely considering lawsuit
1,I don’t know anybody who loves anything more than Buck Martinez talking about catchers going to one knee,I know anybody loves anything Buck Martinez talking catchers going one knee
1,"Have a day Manny Piña! 👏💪 3 for 6, 2 HR (Grand Slam), 6 RBI  Get Manny's limited edition 'Bratoberfest Bobble' on Friday, Sept 10 commemorating his rehab appearance with us in 2019  https://t.co/U7hF6jM1vF  https://t.co/7wzcOwj2Ew",Have day Manny Piña HR Grand Slam RBI Get Mannys limited edition Bratoberfest Bobble Friday Sept commemorating rehab appearance us httpstcoUhFjMvF httpstcowzcOwjEw
1,"Rob Refsnyder has reached base three times in his first game off the IL, and he scores an insurance run on a two-out, opportunistic bunt single by Andrelton Simmons. No chance at first base.  5-1 Twins.",Rob Refsnyder reached base three times first game IL scores insurance run twoout opportunistic bunt single Andrelton Simmons No chance first base Twins
1,And 2 weeks later still not doing baseball activities...,And weeks later still baseball activities
1,"Playing second and getting picked off add to #Rays Franco’s firsts. Show of support from friends and relatives humbles Walls. And notes from Atlanta on being shutout by #Braves, KK on all-time steals list, Archer rehab update, Phillips’ next pitch, more   https://t.co/oD8CMcs2Tp",Playing second getting picked add Rays Franco firsts Show support friends relatives humbles Walls And notes Atlanta shutout Braves KK alltime steals list Archer rehab update Phillips next pitch httpstcooDCMcsTp
1,@faus24 @Phillies Yup. But they were not healthy enough to trade.,faus Phillies Yup But healthy enough trade
1,@EDuerrwaechter Takeaway bucket is in concussion protocol.,EDuerrwaechter Takeaway bucket concussion protocol
1,@Vets4Mets @koosman2pointOh @StevenACohen2 @Mets Both those guys should be in the mix Cohen is a smart guy I’m sure he feels the same way he sees this team is terribly flaw and signing so many guys off the street to fill in for injured players has to infuriate him he has find a way to rid the organization of its loser mentality,VetsMets koosmanpointOh StevenACohen Mets Both guys mix Cohen smart guy I sure feels way sees team terribly flaw signing many guys street fill injured players infuriate find way rid organization loser mentality
1,Looks like we've got our first rehab start of the summer! @sadler_squared is on the mound (oh and p.s. it's his birthday)  #GoFrogs  https://t.co/CJnLDs1ItR,Looks like got first rehab start summer sadlersquared mound oh ps birthday GoFrogs httpstcoCJnLDsItR
1,"I know it’s easy to be all gloom and doom about Atlanta United, but I think they will be okay. This roster is much more talented than last seasons with the additions of Sosa, Moreno, Ibarra, and Franco along with Josefs return from injury.",I know easy gloom doom Atlanta United I think okay This roster much talented last seasons additions Sosa Moreno Ibarra Franco along Josefs return injury
1,"@JayyXVR Does not make sense to me , old and injured a lot, but I will see.",JayyXVR Does make sense old injured lot I see
1,Just IL the guy,Just IL guy
1,"If you feel like the baseball gods have decided the Diamondbacks can't have nice things -- Exhibit 3,231: Zac Gallen's latest injury -- it's worth remembering that the baseball gods help those who help themselves.  https://t.co/8gqxe6Gm85",If feel like baseball gods decided Diamondbacks nice things Exhibit Zac Gallens latest injury worth remembering baseball gods help help httpstcogqxeGm
1,"Daniel Bard plunked David Peralta. He limps to first, where a mass of teammates greet him. The Diamondbacks win 4-3, once again pickup up a Merrill Kelly start.  It's just the second win this year in which they scored four or fewer runs. Arizona is 24-63.",Daniel Bard plunked David Peralta He limps first mass teammates greet The Diamondbacks win pickup Merrill Kelly start Its second win year scored four fewer runs Arizona
1,@redsoxslut Well that would depend on the owner of said hamstring. The correct answer for what’s better than one closer is two closers!,redsoxslut Well would depend owner said hamstring The correct answer better one closer two closers
1,@AlexDeBrincats Nursing a minor injury,AlexDeBrincats Nursing minor injury
1,@chrisamccoy He’s pitched one inning of rehab,chrisamccoy He pitched one inning rehab
1,Jalen Green clearly limping. Oh no.,Jalen Green clearly limping Oh
1,Boomstick on COVID IL.,Boomstick COVID IL
1,X rays negative for Posey.,X rays negative Posey
1,looked on replay as if he rolled his ankle a bit.,looked replay rolled ankle bit
1,covid got me. see you guys in two weeks  https://t.co/BdkhMLj1Ow,covid got see guys two weeks httpstcoBdkhMLjOw
1,"The big picture question after a rough weekend: Was the Nationals’ sweep at the hands of the Dodgers an injury-plagued, mismatched blip, or a sign of more trouble to come?  https://t.co/seUb2x9k3P",The big picture question rough weekend Was Nationals sweep hands Dodgers injuryplagued mismatched blip sign trouble come httpstcoseUbxkP
1,"Joseph Hernandez dealing through 5IP, 4H, 1R, BB, 8K. Good fo see him healthy again. Bright future.",Joseph Hernandez dealing IP H R BB K Good fo see healthy Bright future
1,"Naw, this is some kind of cult ritual to appease the injury gods after stealing OJ Howard and Vita Vea last year.",Naw kind cult ritual appease injury gods stealing OJ Howard Vita Vea last year
1,@dangercart I'm pretty sure the main problem has been injuries to the other strong teams,dangercart I pretty sure main problem injuries strong teams
1,(2/2) It’s a tremendously sad day and Canada stands shoulder to shoulder tonight with our greatest friend and ally.,It tremendously sad day Canada stands shoulder shoulder tonight greatest friend ally
1,At this point it may be easier for the #Brewers to make daily announcements as to who did NOT test positive for Covid.,At point may easier Brewers make daily announcements NOT test positive Covid
1,"@King_Kemba @MikeAdxx That's a pretty significant change. Basically all their bench guys who were vets were really starters cuz of injuries 99% of the time. Now they actually have bench depth. PP, Nesmith, Romeo and Grant are now 10-13 on the roster instead of 8-11",KingKemba MikeAdxx Thats pretty significant change Basically bench guys vets really starters cuz injuries time Now actually bench depth PP Nesmith Romeo Grant roster instead
1,He got hurt Tuesday night.,He got hurt Tuesday night
1,On all the injured dudes in San Diego (and back home):  https://t.co/LiVV8TsBkg,On injured dudes San Diego back home httpstcoLiVVTsBkg
1,"8/21/2018: Dean Stone dies at age 87 in Moline, IL after a lengthy illness. The southpaw pitched the first complete-game shutout in Colt .45s/#Astros history on April 12, 1962, a 2-0 win over the Cubs in the franchise's inaugural series.  https://t.co/g41ViDH8tz  https://t.co/pxHRfIl28I",Dean Stone dies age Moline IL lengthy illness The southpaw pitched first completegame shutout Colt sAstros history April win Cubs franchises inaugural series httpstcogViDHtz httpstcopxHRfIlI
1,@Bigchilling__ That happens with injuries sometimes,Bigchilling That happens injuries sometimes
1,"Wade LeBlanc when asked by @TheCatOnBallyTV if he feels pressure to maintain his current form as rotation injuries mount: ""The only pressure that I feel is to throw strikes.""  TV: Bally Sports Midwest App: Bally Sports app #STLFLY  https://t.co/IWq0232EI1",Wade LeBlanc asked TheCatOnBallyTV feels pressure maintain current form rotation injuries mount The pressure I feel throw strikes TV Bally Sports Midwest App Bally Sports app STLFLY httpstcoIWqEI
1,"@phillybos With the injuries, really no choice",phillybos With injuries really choice
1,"The epidemic of injuries, Daulton Varsho and pop-culture irritants are among this week’s topics for the SnakePit writers.   https://t.co/SEnKROR7IK",The epidemic injuries Daulton Varsho popculture irritants among week topics SnakePit writers httpstcoSEnKRORIK
1,@barstoolWSD @JamesFox917 @Tjshields18 they need the 40 man spot and he's not going to be able to pitch until 2023 if he got or is getting TJS. Cold but seems like they weren't going to pay a guy who wouldn't suit up all of 2022 due to injury.,barstoolWSD JamesFox Tjshields need man spot going able pitch got getting TJS Cold seems like going pay guy would suit due injury
1,"Suicide bombers attack Kabul airport, Americans among the injured amid evacuations  https://t.co/Fgijobv2kV",Suicide bombers attack Kabul airport Americans among injured amid evacuations httpstcoFgijobvkV
1,@RobbiePlute @Mariners I think this has to do with injuries,RobbiePlute Mariners I think injuries
1,How many injuries are we away from an essay contest where you make your case for why you could be an innings eater?,How many injuries away essay contest make case could innings eater
1,"Jorge Lopez sits 95 with the fastball. It’s dropped below 90 suddenly, to the point Savant is calling it a changeup. He keeps working his shoulder like it’s hurt. Why is he still out there?",Jorge Lopez sits fastball It dropped suddenly point Savant calling changeup He keeps working shoulder like hurt Why still
