injury_report,tweet,clean
1,"Multiple Yankees test positive for coronavirus, forcing game vs. Red Sox to be postponed  https://t.co/88l1ef0SvV",Multiple Yankees test positive coronavirus forcing game vs Red Sox postponed httpstcolefSvV
1,"“When you start making moves out of team needs that aren’t necessarily driven by the player’s own development, you can get into trouble that way.""  Spoke to Chaim Bloom about why the Red Sox waited until now to call up Jarren Duran:  https://t.co/srigyWqYqD via @bostonherald",When start making moves team needs necessarily driven player development get trouble way Spoke Chaim Bloom Red Sox waited call Jarren Duran httpstcosrigyWqYqD via bostonherald
1,Girardi: Alec Bohm tested positive. He will miss at least 10 days. Other players are in protocols; status is unclear. Phillies had an idea last night they’d need players. Got them here at 9 a.m.,Girardi Alec Bohm tested positive He miss least days Other players protocols status unclear Phillies idea last night need players Got
1,"Maddon said even if they don't play tomorrow, ""it should not be something elongated. That's the original diagnosis I've been given.""",Maddon said even play tomorrow something elongated Thats original diagnosis I given
1,"Cora said Sale and Seabold will both throw live BP in Fort Myers on Tuesday. Sale will work two innings, Seabold will work three innings. #RedSox",Cora said Sale Seabold throw live BP Fort Myers Tuesday Sale work two innings Seabold work three innings RedSox
1,Acuna is walking off the field under his own power but with a noticeable limp.,Acuna walking field power noticeable limp
1,Nick Senzel left the game with a left heel contusion.,Nick Senzel left game left heel contusion
1,José Ramírez being taken to hospital to be checked after fouling ball off his face.  Not sure what else can happen to the #Indians.,José Ramírez taken hospital checked fouling ball face Not sure else happen Indians
1,When the Phillies were in Chicago early in the week a bunch of players weren’t feeling well including Girardi. Girardi thought something was going around the clubhouse. He’s vaccinated but a bunch are not. No idea if there’s a correlation but timing seems interesting.,When Phillies Chicago early week bunch players feeling well including Girardi Girardi thought something going around clubhouse He vaccinated bunch No idea correlation timing seems interesting
1,Ryan Brasier struck in the side of the head earlier today in a simulated game in Fort Myers. Taken to local hospital and currently under observation,Ryan Brasier struck side head earlier today simulated game Fort Myers Taken local hospital currently observation
1,Hicks is just now beginning to play catch. Shildt said he’s still a ways away from full baseball activities.,Hicks beginning play catch Shildt said still ways away full baseball activities
1,"@PalmerGuyBoston @IBWAA Hopefully Dickerson can play again this year, though. That’ll be crucial since he’s a FA this offseason. Sounds like he’s out until August at the earliest.",PalmerGuyBoston IBWAA Hopefully Dickerson play year though That crucial since FA offseason Sounds like August earliest
1,"ICYMI..   JD Davis’ bat returning will be a positive for the Mets. how much of a hindrance his defense will be is TBD, but there could be a way around that @TheAppleNYM #LFGM 🍎  https://t.co/Vk9KqTeyjW",ICYMI JD Davis bat returning positive Mets much hindrance defense TBD could way around TheAppleNYM LFGM httpstcoVkKqTeyjW
1,Matt Ioannidis  was sick today but absence no big deal per Rivera....no timetable for Curtis  Samuel.   @team980 @LockedWFTPod,Matt Ioannidis sick today absence big deal per Riverano timetable Curtis Samuel team LockedWFTPod
1,"* Erik Gonzalez is progressing faster than envisioned and has resumed running at 60% * Ka'ai Tom has resumed baseball activities, throwing and hitting, and has made nice progression and Pirates are optimistic he'll be back shortly after All-Star break.",Erik Gonzalez progressing faster envisioned resumed running Kaai Tom resumed baseball activities throwing hitting made nice progression Pirates optimistic back shortly AllStar break
1,"Kansas big man David McCormack (foot) has been fully cleared for all basketball related activities, per Bill Self. Significant Big 12 news.",Kansas big man David McCormack foot fully cleared basketball related activities per Bill Self Significant Big news
1,#Yankees plan to activate Zack Britton on Thursday,Yankees plan activate Zack Britton Thursday
1,"Realmuto will go through batting practice, Joe Girardi said, and there is a chance the Phillies change the lineup before first pitch to insert him at first base. But they also might just give him another day.",Realmuto go batting practice Joe Girardi said chance Phillies change lineup first pitch insert first base But also might give another day
1,Dusty Baker asked about Jose Urquidy expected to be available to replace Zack Greinke in the rotation while Zack is out due to health and safety protocols: “We missed Urquidy. He’s one of the main guys on our pitching staff..We’re just fortunate to replace quality with quality.”  https://t.co/ZpVGwRn0ss,Dusty Baker asked Jose Urquidy expected available replace Zack Greinke rotation Zack due health safety protocols We missed Urquidy He one main guys pitching staffWe fortunate replace quality quality httpstcoZpVGwRnss
1,Arroyo said it took two days to walk normally after his collision in Tampa Bay. He started to feel better after a couple more days. #RedSox,Arroyo said took two days walk normally collision Tampa Bay He started feel better couple days RedSox
1,Red Sox received the positive result after first pitch and removed him as soon as they found out.,Red Sox received positive result first pitch removed soon found
1,"Leadoff single in third makes Bryant 7-for-14 since returning from bruised ribs (with HR, BB, RBI).",Leadoff single third makes Bryant since returning bruised ribs HR BB RBI
1,Tanner Scott threw a bullpen session today and nearing a return. Hunter Harvey in Florida and joining Complex League team. Hyde said again hoping for return in Aug 12-16 range. #orioles,Tanner Scott threw bullpen session today nearing return Hunter Harvey Florida joining Complex League team Hyde said hoping return Aug range orioles
1,@johairolopez of course it was. He pulled his oblique when swinging a bat in a game.,johairolopez course He pulled oblique swinging bat game
1,Pagan has a tight neck from sleeping on it.   He has not pitched since Tuesday.   Tingler says he hopes he's available tomorrow.,Pagan tight neck sleeping He pitched since Tuesday Tingler says hopes available tomorrow
1,"""Anthony DeSclafani on his arm fatigue""",Anthony DeSclafani arm fatigue
1,"Zack Britton, just placed on the 60-day DL, likely needs to have bone chips removed from his elbow",Zack Britton placed day DL likely needs bone chips removed elbow
1,Coco Gauff to miss Olympics after testing positive for virus  https://t.co/cGxbIyihwO,Coco Gauff miss Olympics testing positive virus httpstcocGxbIyihwO
1,Eagles waived/injured LB Joe Ostman,Eagles waivedinjured LB Joe Ostman
1,"Red Sox utility man Danny Santana, in camp on a major league invite, is currently hospitalized for a foot infection, being treated with antibiotics.",Red Sox utility man Danny Santana camp major league invite currently hospitalized foot infection treated antibiotics
1,Sam Coonrod had been shut down from throwing for three days. He still feels something in his right elbow.,Sam Coonrod shut throwing three days He still feels something right elbow
1,"Out of the known positives (Cortes, Peralta, Loaisiga), all three were vaccinated. They are doing well, according to Cashman.",Out known positives Cortes Peralta Loaisiga three vaccinated They well according Cashman
1,"Nothing injury-related with Rojas, per team. Ward just felt good enough to start after going through pregame BP",Nothing injuryrelated Rojas per team Ward felt good enough start going pregame BP
1,LaMonte Wade Jr. is out of the game. His foot got stepped on at first earlier. Darin Ruf is now playing first.,LaMonte Wade Jr game His foot got stepped first earlier Darin Ruf playing first
1,"Per Pirates, Evans hit his head sliding into third base in the third inning when he collided with 3B Austin Riley (otherwise known as the play where Braves RF Ronald Acuna showed off his rocket arm). Evans remained in the game until the eighth.",Per Pirates Evans hit head sliding third base third inning collided B Austin Riley otherwise known play Braves RF Ronald Acuna showed rocket arm Evans remained game eighth
1,Francona said C Roberto Pérez came out OK after bruising his hand last night in Akron. He'll catch in Columbus tomorrow and will likely rejoin the #Indians on Saturday.,Francona said C Roberto Pérez came OK bruising hand last night Akron Hell catch Columbus tomorrow likely rejoin Indians Saturday
1,"Yesterday, we wrapped up #HOPEWeek by honoring Blake Wheatley, who was diagnosed with bicuspid aortic valve condition – the same condition that Aaron Boone faces. He spent the day touring the stadium, playing catch with Britton and Boone, and joining the players on the field.  https://t.co/2fSWF5X0tZ",Yesterday wrapped HOPEWeek honoring Blake Wheatley diagnosed bicuspid aortic valve condition condition Aaron Boone faces He spent day touring stadium playing catch Britton Boone joining players field httpstcofSWFXtZ
1,"Good ol' link didn't work properly before.  Near-daily reminder about #Marlins roster/injury runner. Latest on Brian Anderson, Sixto and Co.   https://t.co/DdEn8Ba7on",Good ol link work properly Neardaily reminder Marlins rosterinjury runner Latest Brian Anderson Sixto Co httpstcoDdEnBaon
1,"Ronald Acuña Jr. was walking off on his own power under the guidance of training staff, but he stopped and went to the ground toward the foul line.",Ronald Acuña Jr walking power guidance training staff stopped went ground toward foul line
1,Cole had been vaccinated. There’s still a bit of hope it’s a false positive but the Yankees have had many vaccinated players and staff test positive now.,Cole vaccinated There still bit hope false positive Yankees many vaccinated players staff test positive
1,Mountcastle leaves game after being hit on elbow  https://t.co/lKvotelCTO,Mountcastle leaves game hit elbow httpstcolKvotelCTO
1,"@balldontlie1233 Heard it's the flexor muscle, not the UCL.",balldontlie Heard flexor muscle UCL
1,Seager has a bone bruise after fouling a ball off shin a few days ago.,Seager bone bruise fouling ball shin days ago
1,"#Ravens fear that LB L.J. Fort tore his ACL and is lost for the season, per @jeffzrebiec",Ravens fear LB LJ Fort tore ACL lost season per jeffzrebiec
1,"David Bell says Tejay Antone had a PRP injection earlier this week.  “After that, there’s a little bit of a period where you don’t do a whole lot. He’ll start ramping up here… He should be throwing here any day.""",David Bell says Tejay Antone PRP injection earlier week After little bit period whole lot He start ramping He throwing day
1,OMG Nooooooo!!!!! @Giannis_An34 lands awkwardly on knee and challenging alley-pop to @CapelaClint. He’s being helped off the court. It looks like an ACL.#PrayersUP,OMG Nooooooo GiannisAn lands awkwardly knee challenging alleypop CapelaClint He helped court It looks like ACLPrayersUP
1,"1/#Rays only saving marginal dollars (few hundred thousand) in moving Hill, taking on Hunter, who may never come off the IL the rest of this year. They liked Dyer, who shared catch duties at U. Arizona with Austin Wells, #Yankees 1st round pick in 2020. Plus Archer close to",Rays saving marginal dollars hundred thousand moving Hill taking Hunter may never come IL rest year They liked Dyer shared catch duties U Arizona Austin Wells Yankees st round pick Plus Archer close
1,"The Nats have signed catcher Rene Rivera and optioned Jakson Reetz. They’ve also reinstated Jordy Mercer from the IL. Starlin Castro has been placed on Administrative Leave by Major League Baseball under the Domestic Violence, Sexual Assault and Child Abuse Policy",The Nats signed catcher Rene Rivera optioned Jakson Reetz They also reinstated Jordy Mercer IL Starlin Castro placed Administrative Leave Major League Baseball Domestic Violence Sexual Assault Child Abuse Policy
1,Jalen Reagor is limited today according to the team. He has lower body tightness. Is off to the side running individual drills. But was catching some passes with the WR earlier.,Jalen Reagor limited today according team He lower body tightness Is side running individual drills But catching passes WR earlier
1,Joe Maddon said Max Stassi is currently undergoing some tests. Maddon said he’s better than he was last night. For tonight they just need him to be well enough to play defense if necessary. He was hit by a pitch last night. #Angels,Joe Maddon said Max Stassi currently undergoing tests Maddon said better last night For tonight need well enough play defense necessary He hit pitch last night Angels
1,Finally some good news amidst the @Yankees' COVID-19 breakout.  https://t.co/0zOr1crKvI,Finally good news amidst Yankees COVID breakout httpstcozOrcrKvI
1,"Some interesting reads out there about the spike in soft tissue injuries in baseball and the possible link to the mental and emotional residue of the pandemic. No one can confirm or refute, but it makes as much sense as any other theory. Thankfully, my obliques are fine.",Some interesting reads spike soft tissue injuries baseball possible link mental emotional residue pandemic No one confirm refute makes much sense theory Thankfully obliques fine
1,✅ I’m told Eagles QB Jalen Hurts is “doing just fine” today after going to the hospital last night with a stomach infection   #JalenHurts   #Eagles   https://t.co/jszLJWnbBF,I told Eagles QB Jalen Hurts fine today going hospital last night stomach infection JalenHurts Eagles httpstcojszLJWnbBF
1,"For all of our AMAZING technological advances, sometimes the answer -- still -- is, ""I don't know. Let's give it a week and see how it feels, then.""  P.S. MRI imaging, at best, is still at the bundle level. Sometimes you can measure gaps/laxity, but that isn't typically done.",For AMAZING technological advances sometimes answer still I know Lets give week see feels PS MRI imaging best still bundle level Sometimes measure gapslaxity typically done
1,@Crewsett remotely though because he has COVID,Crewsett remotely though COVID
1,"Francisco Lindor should be activated early this week, Luis Rojas said.   Seems like the Mets are hoping he’s back Tuesday against the Giants. Rojas said the performance staff recommended remaining extra cautious with Lindor, which is why he was not activated today.",Francisco Lindor activated early week Luis Rojas said Seems like Mets hoping back Tuesday Giants Rojas said performance staff recommended remaining extra cautious Lindor activated today
1,Gabe Kapler said Buster Posey won't start tomorrow but it's possible he's available off the bench. The best possible news given how bad that looked.,Gabe Kapler said Buster Posey start tomorrow possible available bench The best possible news given bad looked
1,Servais said he was unsure if JP Crawford will be available to play tomorrow. He said Crawford is really under the weather. They are hoping rest and fluid today can get him back for tomorrow.,Servais said unsure JP Crawford available play tomorrow He said Crawford really weather They hoping rest fluid today get back tomorrow
1,"Jose Ramirez had some swelling after fouling a ball off his face. Team wants to have him checked out real quick, so he's being taken to the hospital to make sure everything is OK.   As for Roberto Perez, who left the game with the RubberDucks, Tito relayed that he's fine.",Jose Ramirez swelling fouling ball face Team wants checked real quick taken hospital make sure everything OK As Roberto Perez left game RubberDucks Tito relayed fine
1,@WiscoWavy @ezraroberts98 @MiLBMariners @EmersonHancock_ Neither pitched last year and both have dealt with shoulder fatigue,WiscoWavy ezraroberts MiLBMariners EmersonHancock Neither pitched last year dealt shoulder fatigue
1,"Morgan Frost’s chances of sticking with the Flyers have improved greatly, and the center says his surgically repaired shoulder is almost 100%  https://t.co/MRfrxCOxEl",Morgan Frost chances sticking Flyers improved greatly center says surgically repaired shoulder almost httpstcoMRfrxCOxEl
1,#Jaguars placed OL A.J. Cann on the Reserve/COVID-19 list.,Jaguars placed OL AJ Cann ReserveCOVID list
1,"#Rays Choi was hit on left kneecap. He made it to 1B slowly, but leaves game. He walked off field under his own power during pitching change and heads back to 1B so he is staying in.",Rays Choi hit left kneecap He made B slowly leaves game He walked field power pitching change heads back B staying
1,"Ballgame.   Blue Jays 2, Tigers 1.  Matthew Boyd went four innings and allowed two solo homers in his return from the IL.  The Tigers' lineup never got going against Jose Berrios. They've scored two runs or fewer in four straight games.  The Tigers are 62-69",Ballgame Blue Jays Tigers Matthew Boyd went four innings allowed two solo homers return IL The Tigers lineup never got going Jose Berrios Theyve scored two runs fewer four straight games The Tigers
1,"Raynel Espinal has been added to the Red Sox roster as the team is hit hard by COVID-19. The 29-year-old righty has been a solid piece of the @WooSox rotation this season going 9-4 with a 3.74 ERA, and 89 strikeouts over 91.1 IP. He also has an OBA of .203, and a 1.12 WHIP.",Raynel Espinal added Red Sox roster team hit hard COVID The yearold righty solid piece WooSox rotation season going ERA strikeouts IP He also OBA WHIP
1,"Of those positive tests, Sills says there is a seven times higher incidence rate among unvaccinated players -- 2.2% in unvaccinated, 0.3% in vaccinated.",Of positive tests Sills says seven times higher incidence rate among unvaccinated players unvaccinated vaccinated
1,"Candace Owens withdrew from a recent event in Texas due to a “sudden illness,” but suggests this test request is due to complying with a small business request for a negative test.  Her most fervent covid-hoaxer followers will be upset she complies for covid test requests.  https://t.co/yrWjQHmcSy",Candace Owens withdrew recent event Texas due sudden illness suggests test request due complying small business request negative test Her fervent covidhoaxer followers upset complies covid test requests httpstcoyrWjQHmcSy
1,"@amaru1994 CP3 playing with a bum wrist, and it’s showing. Sucks.",amaru CP playing bum wrist showing Sucks
1,"@GHalston @IanMBrowne Hunter is one of the best RF in baseball, Alex is one of the best LF, Kiké is one of the best CFs. Alex's hamstring issues this season impacted his speed, making him less effective in CF and RF. That OF defensive alignment is really good.",GHalston IanMBrowne Hunter one best RF baseball Alex one best LF Kiké one best CFs Alexs hamstring issues season impacted speed making less effective CF RF That OF defensive alignment really good
1,@CI_Pratt @ESPNNBA Injuries IMO for Lakers. AD cant stay healthy and now Lebron too. Klay could come back like KD. Yes. One piece. But I think they are #1 now atm,CIPratt ESPNNBA Injuries IMO Lakers AD cant stay healthy Lebron Klay could come back like KD Yes One piece But I think atm
1,"@abeds15 @george4593 Um, do you actually remember his 3 years with the Cubs? First year was injury and bad. Second year was bad/mediocre and then second half great. Third, very short 2020 was elite.  So, yeah, I expect some good but some bad and some injured for his remaining two years.",abeds george Um actually remember years Cubs First year injury bad Second year badmediocre second half great Third short elite So yeah I expect good bad injured remaining two years
1,"@fav0010 @MLB In a good lineup. A gold glove caliber 1B who goes like .250/22/70 and hits like 6th would be excellent. He shouldn't be hitting 3rd, but Lindor slow start, injuries and Conforto (and McNeil to an extent) have forced that reality...",fav MLB In good lineup A gold glove caliber B goes like hits like th would excellent He hitting rd Lindor slow start injuries Conforto McNeil extent forced reality
1,Curt Casali hit a three-run bomb.  Somehow with Buster Posey on the IL the Giants are still getting premium production from the catcher position.   Story of the season for this team.,Curt Casali hit threerun bomb Somehow Buster Posey IL Giants still getting premium production catcher position Story season team
1,"@NjTank99 With all the injuries, maybe you end up right. But the point is you’ve been wrong every day for 4  straight months. You’re like kellerman predicting the Brady downfall.",NjTank With injuries maybe end right But point wrong every day straight months You like kellerman predicting Brady downfall
1,Moncada takes an ugly looking slide into third base when motoring there from first on an Abreu single. Looks like he landed funnily on his right wrist. Trainer giving him a long looksee.,Moncada takes ugly looking slide third base motoring first Abreu single Looks like landed funnily right wrist Trainer giving long looksee
1,"Yadier Molina says it was a difficult decision to not play in the ASG, especially because it falls on his 39th birthday.   ""I would love to go there on my birthday and do something hopefully good that everyone can remember,  but it's something I need to do to come back healthy.""",Yadier Molina says difficult decision play ASG especially falls th birthday I would love go birthday something hopefully good everyone remember something I need come back healthy
1,"Series Preview # 38 : Diamondbacks vs Padres.  With Tatis Jr. on the IL, with good pitching matchups, Diamondbacks will challenge the Padres.  https://t.co/p89kO93bXa  https://t.co/ZiUmX8It0f",Series Preview Diamondbacks vs Padres With Tatis Jr IL good pitching matchups Diamondbacks challenge Padres httpstcopkObXa httpstcoZiUmXItf
1,"For the 2nd time in less than 2 months (even with 2 weeks on the IL), Jordan Walker @jwalker0522 of the @GoPBCardinals is the Low-A Southeast League Player of the Week. 3 HR/7 RBI/1.346 OPS. The 19-year-old 3rd baseman is The Cardinal Nation's no. 4-ranked #stlcards prospect.  https://t.co/IyqaVdYTWG",For nd time less months even weeks IL Jordan Walker jwalker GoPBCardinals LowA Southeast League Player Week HR RBI OPS The yearold rd baseman The Cardinal Nations ranked stlcards prospect httpstcoIyqaVdYTWG
1,"Carlos Martínez retired Trevor Story on a flyout for the first out in the fourth, and then promptly left the game with head trainer Adam Olsen.   Then, it started to rain. So far, just Brandon Waddell and Andew Knizner are left on the field.   Will update on both accords ASAP.",Carlos Martínez retired Trevor Story flyout first fourth promptly left game head trainer Adam Olsen Then started rain So far Brandon Waddell Andew Knizner left field Will update accords ASAP
1,That’s the first home run Sonny Gray has allowed since he came off the IL at the start of July as the Cardinals take a 2-0 lead in the first.,That first home run Sonny Gray allowed since came IL start July Cardinals take lead first
1,The #Marlins lose #MLB 48th best prospect Jake Eder to Tommy John surgery delaying his bright future to now 2023. UGH!!   https://t.co/0hyyepz3a4,The Marlins lose MLB th best prospect Jake Eder Tommy John surgery delaying bright future UGH httpstcohyyepza
1,@FullCountTommy Weren't they saying the injury happened on the diving catch? A few plays later there was a double down the line and he didn't look like he was limping or moving gingerly. He almost threw Carlson out at 2B.,FullCountTommy Werent saying injury happened diving catch A plays later double line look like limping moving gingerly He almost threw Carlson B
1,"Locastro exits game after banging his right knee against the low wall, making a terrific catch on Verdugo's first-inning foul fly. Allen to LF, Wade enters the game in RF.",Locastro exits game banging right knee low wall making terrific catch Verdugos firstinning foul fly Allen LF Wade enters game RF
1,The #StanleyCup underwent successful surgery from his upper-body injury and will be ready for his celebration tour with the @TBLightning. 😅  📸: @StanleyCup  https://t.co/Wi9kGf6e0V,The StanleyCup underwent successful surgery upperbody injury ready celebration tour TBLightning StanleyCup httpstcoWikGfeV
1,"Sources: Damian Lillard played through an abdomen injury during Team USA’s Tokyo Olympics run, which will require further testing upon return to the States. Lillard wanted to continue playing to help USA capture the gold medal.",Sources Damian Lillard played abdomen injury Team USA Tokyo Olympics run require testing upon return States Lillard wanted continue playing help USA capture gold medal
1,"""I hope it'd be the last time""  Mets acting manager Dave Jauss reflects on the game plan for the bullpen after Robert Stock's first inning injury  https://t.co/CSVM3nYuiw  https://t.co/zH4Z3aV5R0",I hope would last time Mets acting manager Dave Jauss reflects game plan bullpen Robert Stocks first inning injury httpstcoCSVMnYuiw httpstcozHZaVR
1,@GottaBelievePod Why do you think the #Mets always seem to get hit with nonstop injuries to their most important players?  I Cunceled at the trade deadline because I knew deGrom wasn't going to come back and the team couldn't score.,GottaBelievePod Why think Mets always seem get hit nonstop injuries important players I Cunceled trade deadline I knew deGrom going come back team could score
