injury_report,tweet,clean
1,"Afer the Acuña injury and 12-minute delay, Fried gave up 3 consecutive singles, then struck out Berti and Alfaro consecutively with bases loaded to protect 5-3 lead.  Fried: 5 IP, 9 H, 3 R, 1 BB, 5 K. Threw 55 strikes in 92 pitches.",Afer Acuña injury minute delay Fried gave consecutive singles struck Berti Alfaro consecutively bases loaded protect lead Fried IP H R BB K Threw strikes pitches
1,@sportjcb @SarahSpain @ESPNNYChris We're just beyond shell shocked with the injuries... I'm really hoping for a healthy team come September,sportjcb SarahSpain ESPNNYChris Were beyond shell shocked injuries I really hoping healthy team come September
1,The Pirates swapping starters on/off the IL.,The Pirates swapping starters onoff IL
1,"August 10th-On This Day in BC Sport History: 1984  Burnaby's Bob Molle wins a silver medal in 100+kg super heavyweight freestyle wrestling at the Olympic Games in Los Angeles, only 18 days after back surgery. Molle defeated wrestlers from Senegal, Japan, and Egypt before.../2  https://t.co/fGYuOZGxJf",August thOn This Day BC Sport History Burnabys Bob Molle wins silver medal kg super heavyweight freestyle wrestling Olympic Games Los Angeles days back surgery Molle defeated wrestlers Senegal Japan Egypt httpstcofGYuOZGxJf
1,@RebabkkeyO Yep he's rehabbing.,RebabkkeyO Yep rehabbing
1,We know #Jays need bullpen help. But nucleus of team is great and YOUNG. I'm not prepared to advocate giving away farm for some veteran reliever who is having a good year who might flame out quickly. Many don't want to hear this - but patience required. Injuries a big factor.,We know Jays need bullpen help But nucleus team great YOUNG I prepared advocate giving away farm veteran reliever good year might flame quickly Many want hear patience required Injuries big factor
1,Our beat reporter @RuiterWrongFAN has more on the injury to Myles Garrett.    https://t.co/4ErA7Wbpcy,Our beat reporter RuiterWrongFAN injury Myles Garrett httpstcoErAWbpcy
1,The attorneys said their new firm is a boutique law practice that will focus on wrongful death and catastrophic personal injury matters for plaintiffs. #phoenix #flagstaff   https://t.co/nqqXqOVkDz,The attorneys said new firm boutique law practice focus wrongful death catastrophic personal injury matters plaintiffs phoenix flagstaff httpstconqqXqOVkDz
1,"8th-rd @MLBDraft pick Colton Gordon signs w/@Astros for $127,500 (pick 238 value = $174K). Pitchability LHP from @UCF_Baseball had TJ surgery this year. Fringy stuff plays up b/c of deception and funky delivery. #Astros #MLBDraft",thrd MLBDraft pick Colton Gordon signs wAstros pick value K Pitchability LHP UCFBaseball TJ surgery year Fringy stuff plays bc deception funky delivery Astros MLBDraft
1,How are you feeling now after yesterday's news on Giannis' injury? - The @RamieIsTweeting Show  Call: 414-799-1250 Listen LIVE:  https://t.co/dc5ZG1bfdd or @Audacy app  https://t.co/BR8OwL0GQE,How feeling yesterdays news Giannis injury The RamieIsTweeting Show Call Listen LIVE httpstcodcZGbfdd Audacy app httpstcoBROwLGQE
1,ASU quarterback Jayden Daniels was taken to the locker room with an injury. Trenton Bourguet is now in at QB for the Devils.  Q3 (4:53): ASU 34 | Southern Utah 7,ASU quarterback Jayden Daniels taken locker room injury Trenton Bourguet QB Devils Q ASU Southern Utah
1,"Don’t care if it comes off his shoulder a bit, this is sensational from Kai Havertz 🔥  https://t.co/caeSatc1Ga",Don care comes shoulder bit sensational Kai Havertz httpstcocaeSatcGa
1,@McGritterson I assume some kind of injury for him when there have been home run gaps in his career,McGritterson I assume kind injury home run gaps career
1,@ArionNation If only Acuña wasn’t hurt,ArionNation If Acuña hurt
1,Injuries are exposing Patriots’ lack of depth at certain positions  https://t.co/T0TlEvaRkh,Injuries exposing Patriots lack depth certain positions httpstcoTTlEvaRkh
1,"Mentions David Cone with the Royals. The Ed Hearn trade didn't seem so bad at the time, Cone seemed like a wild reliever with a major knee injury.",Mentions David Cone Royals The Ed Hearn trade seem bad time Cone seemed like wild reliever major knee injury
1,Bullpen strong in Orioles' 6-1 win over Nationals; Valaika hits 2 homers; Tyler Wells goes on injured list  https://t.co/hZe7XyPcVo,Bullpen strong Orioles win Nationals Valaika hits homers Tyler Wells goes injured list httpstcohZeXyPcVo
1,We miss ya bud. Get healthy soon! via /r/Braves  https://t.co/k9KGdLanjh,We miss ya bud Get healthy soon via rBraves httpstcokKGdLanjh
1,@CMSFGiants oh Craig. Caught a lot of garbage about it. Wrote about how a bunch of random injuries convinced everyone that Craig injured his guys by teaching them the splitter.,CMSFGiants oh Craig Caught lot garbage Wrote bunch random injuries convinced everyone Craig injured guys teaching splitter
1,@TheRealHampton4 He hit the IL early and just hasn’t been the same. Those homers in philly have derailed him for sure,TheRealHampton He hit IL early Those homers philly derailed sure
1,Opinion: Next few days loom large for US gymnasts after alternate's positive COVID test  https://t.co/jwuHOurVn7,Opinion Next days loom large US gymnasts alternates positive COVID test httpstcojwuHOurVn
1,On the @DannyMacTV show w/@BKSportsTalk Podcast  - Who do the #STLFLY turn to with C-Mart going to the IL? - Is Ovieado about to take the next step? - @USABaseball Bench Coach Jerry Weinstein (@JWonCATCHING)   Podcast Presented By @EyePromiseGG:  https://t.co/CloBWJUuTj  https://t.co/g8qscVbAc6,On DannyMacTV show wBKSportsTalk Podcast Who STLFLY turn CMart going IL Is Ovieado take next step USABaseball Bench Coach Jerry Weinstein JWonCATCHING Podcast Presented By EyePromiseGG httpstcoCloBWJUuTj httpstcogqscVbAc
1,"wake up, it's an Andrew Knizner start! Nick Castellanos, though, is on the IL all weekend.  tonight, against RHP Tyler Mahle:  Carlson RF Goldschmidt 1B Arenado 3B O'Neill LF DeJong SS Bader CF Edman 2B Knizner C LeBlanc LHP",wake Andrew Knizner start Nick Castellanos though IL weekend tonight RHP Tyler Mahle Carlson RF Goldschmidt B Arenado B ONeill LF DeJong SS Bader CF Edman B Knizner C LeBlanc LHP
1,"@cmccosky Garneau doing it. It's the same ole thing, @tigers  have an injury so they just call up another star from down on the farm.😎 @evanwoodbery @beckjason @patcaputo98 @DougAndGator971",cmccosky Garneau Its ole thing tigers injury call another star evanwoodbery beckjason patcaputo DougAndGator
1,First play.  Giannis tests the knee trying for an alley oop dunk #Bucks,First play Giannis tests knee trying alley oop dunk Bucks
1,Hacksaw's Mini Poll....  NBA Worst Nightmare...Injuries destroy virtually all top teams in NBA playoffs  Suns-Atlanta..you going to watch NBA finals..with Lakers-Clippers-Boston-Phila-Milwaukee ravaged by injuries..,Hacksaws Mini Poll NBA Worst NightmareInjuries destroy virtually top teams NBA playoffs SunsAtlantayou going watch NBA finalswith LakersClippersBostonPhilaMilwaukee ravaged injuries
1,Paint Valley overcomes key injuries to get big win over Blanchester in its season opener  https://t.co/zWon5zF5N5,Paint Valley overcomes key injuries get big win Blanchester season opener httpstcozWonzFN
1,@Halosfan93 @Angels They’re injured there’s a difference,Halosfan Angels They injured difference
1,"If I had an ownership group that thought THIS was the year to go all in and mortgage the future, I’d be horrendously concerned for the future. Look around and all you see is injuries or guys having career low years…yea let’s go all in and try to beat the Dodgers 😂😂 Moronic",If I ownership group thought THIS year go mortgage future I horrendously concerned future Look around see injuries guys career low let go try beat Dodgers Moronic
1,"Rough night for Johnny Cueto, just off COVID IL; offense slim in Giants' loss;defense not great, OF not producing much - but Quintana was very good as a one saving grace  https://t.co/J8E3fVHXJU via @sfchronicle",Rough night Johnny Cueto COVID IL offense slim Giants lossdefense great OF producing much Quintana good one saving grace httpstcoJEfVHXJU via sfchronicle
1,"Avoid heatstroke-related injury and death by never leaving a child alone in a car, not even for a minute. Learn more about how to prevent heatstroke in hot cars this summer from @safekids. #WhereHopeRises   https://t.co/UYTegZ6dKi",Avoid heatstrokerelated injury death never leaving child alone car even minute Learn prevent heatstroke hot cars summer safekids WhereHopeRises httpstcoUYTegZdKi
1,He also said this is his style of pitching. Said it was harder earlier in the year when he was hurt and not going well to be as expressive as he likes to be.,He also said style pitching Said harder earlier year hurt going well expressive likes
1,"González in his return off the IL went:  single single sac fly double double strikeout  Giants lead, 7-2",González return IL went single single sac fly double double strikeout Giants lead
1,Kiké Hernandez swung at ball four leading off the 9th.  Aroldis Chapman fresh off the IL might give you a look at an explosion if allowed. Doesn't feel like that kind of night. #RedSox,Kiké Hernandez swung ball four leading th Aroldis Chapman fresh IL might give look explosion allowed Doesnt feel like kind night RedSox
1,"Damn, that would suck to hear if KZ Milton is hurt again…… kid was ripe for greatness at UCF before his injury 😢🙏🏻",Damn would suck hear KZ Milton hurt kid ripe greatness UCF injury
1,‘Modern Family’ Star Julie Bowen and Her Sister Help Injured Woman at National Park  https://t.co/XjRQdJan9V,Modern Family Star Julie Bowen Her Sister Help Injured Woman National Park httpstcoXjRQdJanV
1,BREAKING: A 3-year-old girl and two police officers were injured in a crash in Philadelphia's Port Richmond neighborhood  https://t.co/zDLbPFwv8I,BREAKING A yearold girl two police officers injured crash Philadelphias Port Richmond neighborhood httpstcozDLbPFwvI
1,"Aside from Jacob deGrom, which Mets injury do you think has most impacted the Mets this season?  VOTE:  https://t.co/LrsunCqax3  ➡️ @DoorDash   (Keith could use your help, @SteveKornacki)  https://t.co/YQNnieMMm3",Aside Jacob deGrom Mets injury think impacted Mets season VOTE httpstcoLrsunCqax DoorDash Keith could use help SteveKornacki httpstcoYQNnieMMm
1,@LouDiPietroWFAN @jrobertmartinez ...Nestor/Wandy to COVID list.,LouDiPietroWFAN jrobertmartinez NestorWandy COVID list
1,"Rob Refsnyder has reached base four times in his first game off the IL. Single, double, two walks.",Rob Refsnyder reached base four times first game IL Single double two walks
1,Bullpen strong in Orioles’ 6-1 win over Nationals; Valaika hits 2 homers; Tyler Wells goes on injured list  https://t.co/SEjt5XLCsF,Bullpen strong Orioles win Nationals Valaika hits homers Tyler Wells goes injured list httpstcoSEjtXLCsF
1,"The boys are back in town 🤘  @JenTalksSports previews the series opener against the Rangers! Logan Gilbert faces Texas for the second time, J.P. Crawford is back in the lineup, and we will have injury updates for you! Join us at 6:30 PM PT on ROOT SPORTS 📺⚾️  #MarinersMinute  https://t.co/yopmSSMtnk",The boys back town JenTalksSports previews series opener Rangers Logan Gilbert faces Texas second time JP Crawford back lineup injury updates Join us PM PT ROOT SPORTS MarinersMinute httpstcoyopmSSMtnk
1,"@matthewlubbeck @SNYtv He stinks and he's injured. His defense is good, that's about it.",matthewlubbeck SNYtv He stinks injured His defense good
1,@ShamsCharania @MsSamanthaMay Shocking an injured Celtic,ShamsCharania MsSamanthaMay Shocking injured Celtic
1,"@MattEhalt deGrom is injured and every player on the Mets' core has been injured, is badly underperforming, or both. I've never seen anything like this in all of my years of watching baseball.   We're still ""in it"", had a decent offseason, and are positioned to improve in 2022. That's good!",MattEhalt deGrom injured every player Mets core injured badly underperforming I never seen anything like years watching baseball Were still decent offseason positioned improve Thats good
1,"With Fernando Tatis Jr. on the IL, the Padres only have three All-Stars in their infield now.  An Adam Frazier walk, a Manny Machado rope, a Jake Cronenworth gapper, and it's 2-0 Padres in the first.",With Fernando Tatis Jr IL Padres three AllStars infield An Adam Frazier walk Manny Machado rope Jake Cronenworth gapper Padres first
1,BECAUSE HE JUST RECOVERED FROM COVID!!!!!!!!!,BECAUSE HE JUST RECOVERED FROM COVID
1,"Alex Cobb came out to start the 6th, but he left the mound with a trainer without throwing a pitch.  Steve Cishek is entering.  #Angels up 4-2",Alex Cobb came start th left mound trainer without throwing pitch Steve Cishek entering Angels
1,Jeannette Copeland-Estrada fell &amp; injured herself on the job in May. She lost her insurance because she didn't work in June. She has insurance again but is still in a tenuous spot. “I don’t want to end up being homeless. I have my grandson to worry about.”  https://t.co/DEY9A9vigB,Jeannette CopelandEstrada fell amp injured job May She lost insurance work June She insurance still tenuous spot I want end homeless I grandson worry httpstcoDEYAvigB
1,"Nick Castellanos is watching the game from the dugout railing. Hopefully, it's a good sign that he's back in the dugout after he was hit by a pitch and left the game in the 4th inning. #Reds",Nick Castellanos watching game dugout railing Hopefully good sign back dugout hit pitch left game th inning Reds
1,US COVID Deaths Fully vaccinated (left) Not fully vaccinated (right)  https://t.co/Av3RjcTsCK,US COVID Deaths Fully vaccinated left Not fully vaccinated right httpstcoAvRjcTsCK
1,"DeSclafani leaves in the second inning with an injury, Mets have 3 hits (all singles) and 0 runs through 8 innings. Lmao. Imagine being offended or disagreeing with this tweet? Screw this offense. They deserve every bit of vitriol the fans and front office give them.",DeSclafani leaves second inning injury Mets hits singles runs innings Lmao Imagine offended disagreeing tweet Screw offense They deserve every bit vitriol fans front office give
1,@Castellani2014 Matt Chapman had major offseason surgery,Castellani Matt Chapman major offseason surgery
1,Canada has summoned Orlando City forward Tesho Akindele as an injury replacement at the Gold Cup  https://t.co/VCKMa5i38a,Canada summoned Orlando City forward Tesho Akindele injury replacement Gold Cup httpstcoVCKMaia
1,"Bassitt is the ultimate contrarian in today's game. In the age of chase, he relies on fastballs more than about every pitcher. He tossed his weighted ball program thinking it led to his 2016 Tommy John surgery. He believes analytics doesn't capture his throwing motion's deception",Bassitt ultimate contrarian todays game In age chase relies fastballs every pitcher He tossed weighted ball program thinking led Tommy John surgery He believes analytics capture throwing motions deception
1,"The Chicago #WhiteSox (51-35), despite their slew of injuries, are running away with the AL Central. They have an 8-game lead with Cleveland (42-42) dropping ninth in a row after being no-hit (not an official no-hitter) against the #Rays in the 2nd game of the DH. #Octoberbound",The Chicago WhiteSox despite slew injuries running away AL Central They game lead Cleveland dropping ninth row nohit official nohitter Rays nd game DH Octoberbound
1,@george4593 doesn’t the whole team have COVID?,george whole team COVID
1, https://t.co/NWnShahY9t,httpstcoNWnShahYt
1,@DHobstetter Yeah. I'm with Ritzo and Allegri that I did not see anything on the at bat and in the field that Luciano hurt himself. Hopefully he's okay.,DHobstetter Yeah I Ritzo Allegri I see anything bat field Luciano hurt Hopefully okay
1,"In his past two rehab starts for Triple-A Gwinnett, Touki Toussaint is 2-0 with a 1.50 ERA, 0.75 WHIP and .132 opp. BA, and has 18 strikeouts with four walks in 12 innings (six in each)",In past two rehab starts TripleA Gwinnett Touki Toussaint ERA WHIP opp BA strikeouts four walks innings six
1,"#Rays Walls said no doubt play in 3rd inning on the ball he fielded and then Franco collided with him was an error, should have been called that way from the start",Rays Walls said doubt play rd inning ball fielded Franco collided error called way start
1,"Here we go. Newsletter items on Joey Gallo, a couple odd-ball stats, 2018 draftees, a relatable injury and, of course, a doggy video. #Rangers  https://t.co/YIe1QGIYgc",Here go Newsletter items Joey Gallo couple oddball stats draftees relatable injury course doggy video Rangers httpstcoYIeQGIYgc
1,Some people come to Seattle to catch a fish at Pike Place Market or visit the Space Needle. Domingo German opted for emergency root canal surgery.,Some people come Seattle catch fish Pike Place Market visit Space Needle Domingo German opted emergency root canal surgery
1,"@Carolene_x0 I agree. How many times did a “report” come out about a Mets player on their way out, that they were tough to get along with or a clubhouse cancer or some other absolute bullshit? It was ridiculous.",Carolenex I agree How many times report come Mets player way tough get along clubhouse cancer absolute bullshit It ridiculous
1,Kyle Schwarber is taking BP on the field at Camden Yards.,Kyle Schwarber taking BP field Camden Yards
1,"Core Kluber’s line in his rehab start today: 1.1 IP, 2H, 5ER, 4BB, 1K – 45 pitches, only 20 for strike  (H/T @RandyMiller @BryanHoch)",Core Kluber line rehab start today IP H ER BB K pitches strike HT RandyMiller BryanHoch
1,Second time this year I've seen Mejia strike out on a pitch that hit him in the leg.  Harvey may get a no-hitter tonight,Second time year I seen Mejia strike pitch hit leg Harvey may get nohitter tonight
1,"The introduction to ""The Grieveance Room"" from @TaylorJed73 about Tribe injuries and the NBA Lottery    https://t.co/VKpyTTJaD4",The introduction The Grieveance Room TaylorJed Tribe injuries NBA Lottery httpstcoVKpyTTJaD
1,"Ancient history, buddy. Three times on the IL already this season for Tatis. Let me know when he plays close to an entire 162-game season. He’s stealing big money.",Ancient history buddy Three times IL already season Tatis Let know plays close entire game season He stealing big money
1,@chilllblinton @baseballbrewzne @Brewers @BallySportWI @620wtmj I firmly believe that he's still got that injury in his mind.,chilllblinton baseballbrewzne Brewers BallySportWI wtmj I firmly believe still got injury mind
1,@IsaacS19T Monty and Cole have covid,IsaacST Monty Cole covid
1,"This afternoon, the Sandy Springs Police arrested injured Braves outfielder Marcell Ozuna on charges related to domestic violence.  https://t.co/JWOfSNK7en",This afternoon Sandy Springs Police arrested injured Braves outfielder Marcell Ozuna charges related domestic violence httpstcoJWOfSNKen
1,"A 13-year-old boy was killed by lightning at Orchard Beach in the Bronx. Five others were injured, including three other children, the police said.  https://t.co/zP6tCekEme",A yearold boy killed lightning Orchard Beach Bronx Five others injured including three children police said httpstcozPtCekEme
1,Game 103 notes..The Nats and Cubs meet for the first time in DC since May 2019.  The Nats are 1-3 vs Cubs this year with Chicago winning the series at Wrigley in May.  Jake Arrieta comes off the IL to face Paolo Espino.  Enjoy the broadcast.,Game notesThe Nats Cubs meet first time DC since May The Nats vs Cubs year Chicago winning series Wrigley May Jake Arrieta comes IL face Paolo Espino Enjoy broadcast
1,"Vinny Castilla &amp; Dante Bichette were tough outs. Before injuries dogged him, Troy Tulowitzki ranked among the best in the bigs. Larry Walker got my Hall of Fame vote. Nolan Arenado, for all the recognition he has received, is STILL underrated. But I have to go with Todd Helton.",Vinny Castilla amp Dante Bichette tough outs Before injuries dogged Troy Tulowitzki ranked among best bigs Larry Walker got Hall Fame vote Nolan Arenado recognition received STILL underrated But I go Todd Helton
1,@MichaelV11391 @BleacherNation The only thing I've seen is a note from one of Sharma's articles that he was out with a shoulder injury. No mention of how serious.,MichaelV BleacherNation The thing I seen note one Sharmas articles shoulder injury No mention serious
1,"Podcast  https://t.co/4lP1f6WU3J @Kurkjian_ESPN talks Kumar Rocker, changing of the guard in Chicago, the Rays, the Tatis injury; a conversation with Nelson Cruz; Wander Franco; Alex Cora.",Podcast httpstcolPfWUJ KurkjianESPN talks Kumar Rocker changing guard Chicago Rays Tatis injury conversation Nelson Cruz Wander Franco Alex Cora
1,"@bipolarguy86 @AuthorShaunHolt @Fila_Matt @RealSkylarLewis Players also risk injury, worse performance and losing on guaranteed money. It's why they want those big deals.",bipolarguy AuthorShaunHolt FilaMatt RealSkylarLewis Players also risk injury worse performance losing guaranteed money Its want big deals
1,@AshleyBaker_21 I hate the CTE reasoning. Because we’ve all had drunken nights with bad decisions at 1 AM. Was this unnecessary? Absolutely. But I’m not looking at this and saying “he has a brain injury”.,AshleyBaker I hate CTE reasoning Because drunken nights bad decisions AM Was unnecessary Absolutely But I looking saying brain injury
1,Julio Urias (calf) activated for start on Tuesday  https://t.co/x3kvWPWjSA,Julio Urias calf activated start Tuesday httpstcoxkvWPWjSA
1,Matt Chapman fouled a ball off his left foot and is down.,Matt Chapman fouled ball left foot
1,Roberts said Seager's live batting practice went well and a Wednesday activation is a possibility if he feels good tomorrow.,Roberts said Seagers live batting practice went well Wednesday activation possibility feels good tomorrow
1,“It was terrible.”  Padres pregame: Going for another sweep of Reds; Blake Snell recovering from food poisoning  https://t.co/MpkwUrMfz7,It terrible Padres pregame Going another sweep Reds Blake Snell recovering food poisoning httpstcoMpkwUrMfz
1,Domingo Germán takes over for the Yankees in the 5th inning.   He was tonight's scheduled starter but needed an emergency root canal earlier this afternoon in Seattle.,Domingo Germán takes Yankees th inning He tonights scheduled starter needed emergency root canal earlier afternoon Seattle
1,Geoff had lost his mom to cancer and tore his ACL the same year. In 2021 he was excited to play at @GallatinSchools but the team gear was badly needing repair. His coach called him in to see the new donations &amp; Geoff smiled the whole time. He took care of it as if it were his own  https://t.co/kP4t7Q70Z0,Geoff lost mom cancer tore ACL year In excited play GallatinSchools team gear badly needing repair His coach called see new donations amp Geoff smiled whole time He took care httpstcokPtQZ
1,"Arkansas' KK Robinson (foot) has been fully cleared for all basketball related activities, per Eric Musselman.",Arkansas KK Robinson foot fully cleared basketball related activities per Eric Musselman
1,"Best wishes to Keith Hernandez, who needed eight stitches on his big toe following a hot tub-related gardening accident, per Gary Cohen on the SNY broadcast. Looking forward to seeing Keith back at the ballpark later this week.",Best wishes Keith Hernandez needed eight stitches big toe following hot tubrelated gardening accident per Gary Cohen SNY broadcast Looking forward seeing Keith back ballpark later week
1,"Creighton's Rati Andronikashvili (ACL) and Modestas Kancleris (ACL) are both ""getting close"" to being fully cleared, per Greg McDermott.  McDermott on Andronikashvili and Kancleris: ""Doing most everything except full contact.""",Creightons Rati Andronikashvili ACL Modestas Kancleris ACL getting close fully cleared per Greg McDermott McDermott Andronikashvili Kancleris Doing everything except full contact
1,Wong sidelined again  https://t.co/SzKIgpWtsQ,Wong sidelined httpstcoSzKIgpWtsQ
1,"Stassi just took a foul ball off his mask and was shaken up, but is staying in the game after being checked out by trainers",Stassi took foul ball mask shaken staying game checked trainers
1,Mark Canha departs early due to eye irritation  https://t.co/bOEri0dmPT,Mark Canha departs early due eye irritation httpstcobOEridmPT
1,Those on active/PUP list count against 90-man roster limit and can return to practice at any time.,Those activePUP list count man roster limit return practice time
1,"C Robert Hainsey will not play Saturday, per Arians. Has been sidelined more than a week. #Bucs",C Robert Hainsey play Saturday per Arians Has sidelined week Bucs
1,"VCU's Ace Baldwin (achilles) is targeting a January 1st return date, per Mike Rhoades. Significant Atlantic 10 news.  Rhoades on Baldwin: ""Doing well and ahead of schedule.""",VCUs Ace Baldwin achilles targeting January st return date per Mike Rhoades Significant Atlantic news Rhoades Baldwin Doing well ahead schedule
1,"De La Hoya pulls out of Sept. 11 fight, says he has COVID  https://t.co/a50LeiF3RS",De La Hoya pulls Sept fight says COVID httpstcoaLeiFRS
1,"Medical Update on Mike Soroka – This past Thursday while walking to the clubhouse at Truist Park, Mike Soroka felt a pop in his right Achilles.",Medical Update Mike Soroka This past Thursday walking clubhouse Truist Park Mike Soroka felt pop right Achilles
1,#Chiefs offensive lineman Laurent Duvernay-Tardif to miss 4-6 weeks with a broken bone in his right hand.  https://t.co/OVDQ6S7bKN,Chiefs offensive lineman Laurent DuvernayTardif miss weeks broken bone right hand httpstcoOVDQSbKN
1,Castellanos will not be activated today. He will take more BP on the field soon. #reds,Castellanos activated today He take BP field soon reds
