injury_report,tweet,clean
0,Imagine how quickly it would have happened with the backing of a legit blog.,Imagine quickly would happened backing legit blog
0,Head Athletic Trainer - Dubuque Fighting Saints (Dubuque · IA)  https://t.co/O3hbJIIWVf,Head Athletic Trainer Dubuque Fighting Saints Dubuque IA httpstcoOhbJIIWVf
0,"Bye, bye baseball! #Reds #ATOBTTR  https://t.co/ADHV81V47i",Bye bye baseball Reds ATOBTTR httpstcoADHVVi
0,@MLBStats @Padres On paper sure? I think the White Sox will perform better than the Yankees and Nationals. I also think the Brewers and Braves will perform better than the Phillies. Reds are a toss up after loosing Bauer and seeing how Sonny is to start the season.,MLBStats Padres On paper sure I think White Sox perform better Yankees Nationals I also think Brewers Braves perform better Phillies Reds toss loosing Bauer seeing Sonny start season
0,@Nats_Chat Sure. But they could still easily carry them both on the same roster until Schwarber is back.,NatsChat Sure But could still easily carry roster Schwarber back
0,Ready to be hurt again. #Dodgers,Ready hurt Dodgers
0,Avi Garcia back in RF for #Brewers today.,Avi Garcia back RF Brewers today
0,"Canada, Serbia win as Olympic qualifiers begin  https://t.co/CR9OrmSonX  https://t.co/Lavm3G6IJ6",Canada Serbia win Olympic qualifiers begin httpstcoCROrmSonX httpstcoLavmGIJ
0,Reds notes  -Prospect Mark Kolozsvary on his anticipation to play for Team USA in the Olympics -Tyler Naquin update -Michael Lorenzen update    https://t.co/v1Z4GyXKyM,Reds notes Prospect Mark Kolozsvary anticipation play Team USA Olympics Tyler Naquin update Michael Lorenzen update httpstcovZGyXKyM
0,"No limitations will be placed on Game 2 starter Aaron Ashby, manager Craig Counsell says.",No limitations placed Game starter Aaron Ashby manager Craig Counsell says
0,"The #SFGiants recalled Joey Bart and optioned Logan Webb to Triple-A.  They can call Webb up the next time they need a fifth starter, so this gives them an extra position player for the next two days.",The SFGiants recalled Joey Bart optioned Logan Webb TripleA They call Webb next time need fifth starter gives extra position player next two days
0,Lining up for Darvish Day at 6:10pm.  #HungryForMore  https://t.co/mR2YbzzsJQ,Lining Darvish Day pm HungryForMore httpstcomRYbzzsJQ
0,"After three long weeks, @giantprospectiv returns with a complete rundown of the pitching prospects throughout the #SFGiants farm system.  https://t.co/TB1bWllOI6",After three long weeks giantprospectiv returns complete rundown pitching prospects throughout SFGiants farm system httpstcoTBbWllOI
0,The race for the AL East is basically a game of musical chairs right now @Starting9  https://t.co/I5G4MV1xi8,The race AL East basically game musical chairs right Starting httpstcoIGMVxi
0,Yusei was dealing in the first half 🤩  https://t.co/uSChPrJBWV,Yusei dealing first half httpstcouSChPrJBWV
0,"The Red Sox may piggyback starters or taper some of them back in the second half coming of a short season last year. Now fully healthy Tanner Houck will be in the mix.  “There’s no restriction at all with any pitches thrown. It’s Tanner Houck electricity.""  https://t.co/Kmtp2Apcd6",The Red Sox may piggyback starters taper back second half coming short season last year Now fully healthy Tanner Houck mix There restriction pitches thrown It Tanner Houck electricity httpstcoKmtpApcd
0,Me when I notice someone even mildly attractive looking in my direction.,Me I notice someone even mildly attractive looking direction
0,Michael Vick totally gets it 👏  https://t.co/wCOkMnqez5,Michael Vick totally gets httpstcowCOkMnqez
0,Triple-A Indianapolis made the signing of Dee Strange-Gordon official. He is active tonight.,TripleA Indianapolis made signing Dee StrangeGordon official He active tonight
0,Happy first day of THIRD GRADE to the small roommate!  https://t.co/EnubqPun6W,Happy first day THIRD GRADE small roommate httpstcoEnubqPunW
0,"Nationals game notes have tomorrow's starter as TBA. Lester pitching on normal rest today, but then Corbin (Wednesday) and Scherzer (Thursday) will each get an extra day of rest.",Nationals game notes tomorrows starter TBA Lester pitching normal rest today Corbin Wednesday Scherzer Thursday get extra day rest
0,Mets offense has struggled all year but seeing who's had to be used to pinch hit late further explains what's also happened all year to Mets roster.,Mets offense struggled year seeing used pinch hit late explains also happened year Mets roster
0,GOLD MEDALIST ZACH LAVINE 🏅 i,GOLD MEDALIST ZACH LAVINE
0,We do not have an updated start time. We will provide you with an update at approximately 8:30pm.,We updated start time We provide update approximately pm
0,"Even more moving parts for Red Sox: Kiké will get more time at 2B with Duran up, Arroyo working out at 1B.",Even moving parts Red Sox Kiké get time B Duran Arroyo working B
0,Back to la casa,Back la casa
0,Tingler feels “confident” that Snell will start tomorrow.,Tingler feels confident Snell start tomorrow
0,"Final: Lehigh Valley 5, RailRiders 4.  RailRiders won't be back in Moosic until Aug. 31.",Final Lehigh Valley RailRiders RailRiders back Moosic Aug
0,Antonio Brown is a more deserving of the Hall of Fame than Hines Ward or Maurkice Pouncey.,Antonio Brown deserving Hall Fame Hines Ward Maurkice Pouncey
0,Derek Shelton said Max Kranick will be sent back to Indy after tonight. Just a spot start for now. Adds that doesn't mean he won't be back.,Derek Shelton said Max Kranick sent back Indy tonight Just spot start Adds mean back
0,Crushed 💪  https://t.co/H7FXbcPbAu,Crushed httpstcoHFXbcPbAu
0,#MNTwins Martin!,MNTwins Martin
0,"I asked Parra whether he would still be giving ling hugs to Stephen Strasburg. As I asked it, Strasburg was walking by.   “I hope not,” he said with a smile.",I asked Parra whether would still giving ling hugs Stephen Strasburg As I asked Strasburg walking I hope said smile
0,"On Baseball: #RedSox beat #Yankees again. But for Alex Cora, it’s not time to gloat as rivals deal with Covid outbreak:   https://t.co/rkk5Y8BurI",On Baseball RedSox beat Yankees But Alex Cora time gloat rivals deal Covid outbreak httpstcorkkYBurI
0,Strong practice from Jalen Mills. Nearly picked Newton’s first attempt in 11-on-11s. Broke up a Mac Jones pass for N’Keal Harry. Nearly picked Newton again in 7-on-7s. Stride for stride with Isaiah Zuber to help force another incompletion on an accurate deep ball from Jones.,Strong practice Jalen Mills Nearly picked Newton first attempt ons Broke Mac Jones pass N Keal Harry Nearly picked Newton ons Stride stride Isaiah Zuber help force another incompletion accurate deep ball Jones
