injury_report,tweet,clean
0,".@Mets prospect, Jose Butto with a solid outing for the @BKCyclones. 💪  https://t.co/BkZBHorSxu",Mets prospect Jose Butto solid outing BKCyclones httpstcoBkZBHorSxu
0,Patrick Wisdom is in left field for the Cubs tonight. It’s his first career appearance there. His only outfield experience at all in the big leagues? He got seven innings in right in a start earlier this season.  Bryant’s in right tonight. Outfield D optional?,Patrick Wisdom left field Cubs tonight It first career appearance His outfield experience big leagues He got seven innings right start earlier season Bryant right tonight Outfield D optional
0,#OldFriend alert:,OldFriend alert
0,I’m right here Corinna!,I right Corinna
0,Or maybe he dropped a hand weight on his toe!,Or maybe dropped hand weight toe
0,Joe Jiménez is coming in,Joe Jiménez coming
0,The Sixers have released their schedule!!,The Sixers released schedule
0,It's Dave Jauss next @mullyhaugh    https://t.co/SUrgd6d6uu,Its Dave Jauss next mullyhaugh httpstcoSUrgdduu
0,Live!,Live
0,#Badgers practice closed to media today and Sunday. But here is a story on several players explaining why they decided to get vaccinated against COVID. Lots of frank comments.  https://t.co/zv8HgfcnHt,Badgers practice closed media today Sunday But story several players explaining decided get vaccinated COVID Lots frank comments httpstcozvHgfcnHt
0,"Today's Yankees lineup unchanged from last night's rainout... 1. LeMahieu, 2B 2. Judge, RF 3. Sanchez, C 4. Stanton, DH 5. Voit, 1B 6. Torres, SS 7. Urshela, 3B 8. Andujar, LF 9. Gardner, CF SP: Montgomery, LHP",Todays Yankees lineup unchanged last nights rainout LeMahieu B Judge RF Sanchez C Stanton DH Voit B Torres SS Urshela B Andujar LF Gardner CF SP Montgomery LHP
0,Jack Flaherty is getting rocked. He just gave up back-to-back homers.  He's throwing fastballs under 90 mph. And out comes a trainer.,Jack Flaherty getting rocked He gave backtoback homers Hes throwing fastballs mph And comes trainer
0,@gabagoolios .248/.329/.430 from June 1 (not including today). A 109 wRC+.,gabagoolios June including today A wRC
0,"Mookie Betts said he’s had “some nagging things” bugging him over the first half and wants to take the week off. Said the break will “definitely help me to help us.""",Mookie Betts said nagging things bugging first half wants take week Said break definitely help help us
0,"So, yeah, probably mark that down in list of traits that tilt towards @Isiahkf11 being capable of having a real role on the next contending version of the Rangers",So yeah probably mark list traits tilt towards Isiahkf capable real role next contending version Rangers
0,What a night for Yasmani Grandal. 8 RBI!  #WhiteSox,What night Yasmani Grandal RBI WhiteSox
0,"Arians said if anything, TS Fred could force Saturday’s game to be moved up a few hours. Game would not change days, he said. Still waiting to hear from league on that. #Bucs",Arians said anything TS Fred could force Saturday game moved hours Game would change days said Still waiting hear league Bucs
0,@RumblePoniesBB Oops…  https://t.co/GlktwuoYh4,RumblePoniesBB httpstcoGlktwuoYh
0,Transactions: 3B Will Toffey: AAA-active RHP Norwith Gudiño: AA -&gt; AAA SS Will Wilson: A+ -&gt; AA OF Diego Rincones: A+ -&gt; AA INF Nolan Dempsey: ACL -&gt; A+ INF/OF Tyler Wyatt: ACL -&gt; A RHP Abel Adames: ACL -&gt; A 1B Garrett Frechette: A -&gt; ACL RHP Lisander De La Cruz: ACL-active,Transactions B Will Toffey AAAactive RHP Norwith Gudiño AA gt AAA SS Will Wilson A gt AA OF Diego Rincones A gt AA INF Nolan Dempsey ACL gt A INFOF Tyler Wyatt ACL gt A RHP Abel Adames ACL gt A B Garrett Frechette A gt ACL RHP Lisander De La Cruz ACLactive
0,Joe Kelly remains a legend  https://t.co/MkRHurf14C,Joe Kelly remains legend httpstcoMkRHurfC
0,@Naked_Boy27 @barstoolsports  https://t.co/8hOyoG9p51,NakedBoy barstoolsports httpstcohOyoGp
0,From a few weeks ago...  https://t.co/lil2n2yhmz,From weeks ago httpstcolilnyhmz
0,Gallen is coming out of the game.,Gallen coming game
0,Longtime pro sports writer and Braves superfan @bud006 getting you ready for Opening Day (don't miss it) ...,Longtime pro sports writer Braves superfan bud getting ready Opening Day miss
0,@PhoenixWarbird Hopefully sooner rather than later KB👍,PhoenixWarbird Hopefully sooner rather later
0,"Costly error, homers hurt Aaron Nola in loss to Yankees   https://t.co/rQq44Dn24n  [@TyDaubert]",Costly error homers hurt Aaron Nola loss Yankees httpstcorQqDnn TyDaubert
0,"When asked about Andrew Stevenson earlier, Dave Martinez said he wants to keep getting him four ABs a game in Rochester. Interested to see what the Nationals will do post-All Star break. I'd think there's a solid chance Stevenson comes back and Yadiel Hernandez is optioned.",When asked Andrew Stevenson earlier Dave Martinez said wants keep getting four ABs game Rochester Interested see Nationals postAll Star break I would think solid chance Stevenson comes back Yadiel Hernandez optioned
0,Hinch said Boyd is ‘penciled in’ to start at Comerica Park Sunday. Haase expected back Friday.,Hinch said Boyd penciled start Comerica Park Sunday Haase expected back Friday
0,199 cases of #COVID19 in Dallas ISD.  https://t.co/VwktSd2AVN,cases COVID Dallas ISD httpstcoVwktSdAVN
0,"The Atlantic League/MLB grand experiment hasn't affected the game, yet:  https://t.co/SKn3DMzVjH | @jlauterbach1  https://t.co/gnTbwgfrHL",The Atlantic LeagueMLB grand experiment affected game yet httpstcoSKnDMzVjH jlauterbach httpstcognTbwgfrHL
0,"Cora said it's just an off day for Bogaerts.  'He texted me this morning and said, 'I could use one today.'' #RedSox",Cora said day Bogaerts He texted morning said I could use one today RedSox
0,"Some Giants notes. Brandon Belt is starting baseball activities; Thairo Estrada, left fielder.   https://t.co/MPIGbLDurM",Some Giants notes Brandon Belt starting baseball activities Thairo Estrada left fielder httpstcoMPIGbLDurM
0,"Alex Cora said ""we're OK where we're at"" when asked if he feels like he's still one pitcher short in the 'pen. Also mentioned that they're really missing Ryan Brasier.",Alex Cora said OK asked feels like still one pitcher short pen Also mentioned really missing Ryan Brasier
0,Officially official,Officially official
0,"Two-run single for Yan Gomes and the Nationals are up 3-0. Seeing again how much a difference it makes when Gomes and Starlin Castro are locked in (right now, they are extremely locked in).",Tworun single Yan Gomes Nationals Seeing much difference makes Gomes Starlin Castro locked right extremely locked
0,@spencer_martin @BaseballJeff1 One of those rare cases where dealing off the major league roster ends up having a positive overall impact. 5.5 GB the day of that trade which turned out to be low water mark for season. Won division going away by 6 gm,spencermartin BaseballJeff One rare cases dealing major league roster ends positive overall impact GB day trade turned low water mark season Won division going away gm
0,Looking for a Wednesday win!  🆚 @CLBClippers 🏟️ Werner Park 🎟️  https://t.co/XoUcedd7mF 💪 LHP Foster Griffin ⏰ 7:05 p.m. CT 📻  https://t.co/ta5JRAIQZg  https://t.co/5dBHyErt3y,Looking Wednesday win CLBClippers Werner Park httpstcoXoUceddmF LHP Foster Griffin pm CT httpstcotaJRAIQZg httpstcodBHyErty
0,"@Aliesland2 ""official"" means the team has announced it",Aliesland official means team announced
0,This is quite a list.,This quite list
0,"The Giants optioned Mauricio Dubon. Thairo Estrada, who had a 1.057 OPS in Triple-A, takes his spot.",The Giants optioned Mauricio Dubon Thairo Estrada OPS TripleA takes spot
0,Phillies’ rough day gets worse after ninth-inning rally falls short and other observations from 8-7 loss to Diamondbacks  https://t.co/bCh5EJoutC,Phillies rough day gets worse ninthinning rally falls short observations loss Diamondbacks httpstcobChEJoutC
0,"BOT 6 | Jovani Moran was once again, very impressive.  2.0 IP, H, 0R, BB, 3K, 37P/25S  Saints up 4-0 #MNTwins",BOT Jovani Moran impressive IP H R BB K PS Saints MNTwins
0,Something positive!,Something positive
0,"Aaron Boone says Wandy Peralta could ""possibly"" go more than one inning if he's very efficient to start tonight.  He said the bullpen is locked and loaded to cover the rest of the game.",Aaron Boone says Wandy Peralta could possibly go one inning efficient start tonight He said bullpen locked loaded cover rest game
0,@djsoundwave75 Nance got hurt.,djsoundwave Nance got hurt
0,@Sam_Mullan28 The agents of Mike Moustakas and Nick Castellanos would disagree with you.,SamMullan The agents Mike Moustakas Nick Castellanos would disagree
0,"Dodgers vs RH Alcántara:  Betts 9, Muncy 3, Beaty 7, Bellinger 8, Smith 2, Taylor 4, Lux 6, McKinstry 5, Urías LHP",Dodgers vs RH Alcántara Betts Muncy Beaty Bellinger Smith Taylor Lux McKinstry Urías LHP
0,David Bell said he anticipates activating Jeff Hoffman after the break.  “He is a guy that we’ll want as one of our 13 or 14 pitchers on our staff.”  No role determination yet.,David Bell said anticipates activating Jeff Hoffman break He guy want one pitchers staff No role determination yet
0,Everything said about Marlins ejections after Pablo Lopez hit Braves’ Ronald Acuna Jr.  https://t.co/MoJ5o7gLio,Everything said Marlins ejections Pablo Lopez hit Braves Ronald Acuna Jr httpstcoMoJogLio
0,"When it comes to weather forecasting by the Cubs, add Royals manager Mike Matheny to the long list of skeptics.   https://t.co/VjmpM4pK8K",When comes weather forecasting Cubs add Royals manager Mike Matheny long list skeptics httpstcoVjmpMpKK
0,*Cameron,Cameron
0,"#Cubs lineup vs #Dbacks 7/17 (3:10 CT): Contreras C, Rizzo 1B, Báez SS, Bryant 3B, Heyward RF, Hoerner 2B, Happ LF, Ortega CF, Alzolay P",Cubs lineup vs Dbacks CT Contreras C Rizzo B Báez SS Bryant B Heyward RF Hoerner B Happ LF Ortega CF Alzolay P
0,Good luck to 2020 grad TJ McCants @mccants_tj and his Rebel teammates tonight in Arizona!,Good luck grad TJ McCants mccantstj Rebel teammates tonight Arizona
0,Tyler Beede heads back to Sacramento; Giants call up Caleb Baragar  https://t.co/m1z2iqKa2N via @sfchronicle,Tyler Beede heads back Sacramento Giants call Caleb Baragar httpstcomziqKaN via sfchronicle
0,Aaron Judge getting ready for BP  https://t.co/xlTX8Zcnwm,Aaron Judge getting ready BP httpstcoxlTXZcnwm
0,@hsal1112 He made Carlos sick?,hsal He made Carlos sick
0,@Blckshrts Something COVID related.,Blckshrts Something COVID related
0,Tony La Russa said Craig Kimbrel was not available tonight. He said it was not an arm related situation,Tony La Russa said Craig Kimbrel available tonight He said arm related situation
0,Chicago Cubs Lineup: Michael Hermosillo Is Leading Off -  https://t.co/pKGMFwCvGp  https://t.co/GoUWAkY1lm,Chicago Cubs Lineup Michael Hermosillo Is Leading Off httpstcopKGMFwCvGp httpstcoGoUWAkYlm
0,"Even more O's roster news - Orioles claimed RHP Shaun Anderson off waivers from Texas and optioned him to AAA Norfolk.  Also, RHP Konner Wade has been DFA and INF/OF Stevie Wilkerson has cleared outright waivers and accepted an assignment to Triple-A Norfolk.",Even Os roster news Orioles claimed RHP Shaun Anderson waivers Texas optioned AAA Norfolk Also RHP Konner Wade DFA INFOF Stevie Wilkerson cleared outright waivers accepted assignment TripleA Norfolk
0,Yankees lineup tonight vs. Blue Jays...,Yankees lineup tonight vs Blue Jays
0,Truly the 🐐,Truly
0,"He has to show that he can hit RHP more consistently. But good grief, if you think this is among their most serious problems I can’t help you. Know Thy Team.",He show hit RHP consistently But good grief think among serious problems I help Know Thy Team
0,@mattkremnitzer That definitely hits the Palmer MOAN metric in terms of being a top play.,mattkremnitzer That definitely hits Palmer MOAN metric terms top play
0,"News: Manny Machado replaces Ronald Acuña Jr. on NL All-Star team, marking Machado’s first appearance with the @Padres. @MLBNetwork @MLB",News Manny Machado replaces Ronald Acuña Jr NL AllStar team marking Machado first appearance Padres MLBNetwork MLB
0,Official #MLB postponement of #RedSox - Yankees game tonight - @wbz #wbz  https://t.co/bDE1kROgIF,Official MLB postponement RedSox Yankees game tonight wbz wbz httpstcobDEkROgIF
0,"As expected, Dave Martinez confirms that Jon Lester will start here tomorrow.   Other notes: Just a rest day for Victor Robles with him diving around the OF in recent games … Andrew Stevenson like stays with Red Wings until the break … Eyeing post-break return for Alex Avila.",As expected Dave Martinez confirms Jon Lester start tomorrow Other notes Just rest day Victor Robles diving around OF recent games Andrew Stevenson like stays Red Wings break Eyeing postbreak return Alex Avila
0,AJ Puk is firing it..its like explosions going off,AJ Puk firing itits like explosions going
0,@JohnBengals I haven’t had enough of a chance to closely watch Hill. He’s competing for more reps.,JohnBengals I enough chance closely watch Hill He competing reps
0,Cristian Javier has made a real mess. Andre Scrubb is warming.,Cristian Javier made real mess Andre Scrubb warming
0,#Angels today: LHP José Suarez vs. LHP Martín Pérez  https://t.co/O4T38QVwsP,Angels today LHP José Suarez vs LHP Martín Pérez httpstcoOTQVwsP
0,"Luis García set to make his #stlcards debut in the bottom of the inning. Told us on the field this morning that he had a Triple-A opt out on July 1, and since the Yankees didn’t call him up, here he is.",Luis García set make stlcards debut bottom inning Told us field morning TripleA opt July since Yankees call
0,Seahawks back on field today at VMAC.  https://t.co/WZg9jU77mB,Seahawks back field today VMAC httpstcoWZgjUmB
0,"Miguel Rojas called Don Mattingly ""my father in baseball."" Mattingly has been his only #MLB manager, dating back to his time in L.A. #Marlins",Miguel Rojas called Don Mattingly father baseball Mattingly MLB manager dating back time LA Marlins
0,"The Padres lost their MVP candidate last month. But they're getting another MVP-level performance in the middle of their lineup these days. (Plus notes on Tatis, Lamet)   https://t.co/BiwCEcVBEl",The Padres lost MVP candidate last month But getting another MVPlevel performance middle lineup days Plus notes Tatis Lamet httpstcoBiwCEcVBEl
0,"@ArifHasanNFL ""I just looked at my wrist, I got time today""",ArifHasanNFL I looked wrist I got time today
0,@JacobLongSTL Adding it to my list,JacobLongSTL Adding list
0,"#KBO: LG Twins announced today their new 1B Justin Bour @bour41 will arrive in Korea on July 15. He'll serve his mandatory 14-day quarantine, but that should still give him enough time to train and join the Twins in time for the resumption of the season on Aug. 10.",KBO LG Twins announced today new B Justin Bour bour arrive Korea July Hell serve mandatory day quarantine still give enough time train join Twins time resumption season Aug
0,"Was just starting to think of the possibility of #Rays throwing 2 complete games* within 6 weeks after going 5 plus years without one, and Sherriff is throwing in bullpen.  (* Yes it's a CG for the full 7 innings in a doubleheader these days.)",Was starting think possibility Rays throwing complete games within weeks going plus years without one Sherriff throwing bullpen Yes CG full innings doubleheader days
0,George Springer is back in the lineup.  I'm back in my living room.  And this... is the #BlueJays Beat Report:  https://t.co/OSK9dLrsSZ,George Springer back lineup I back living room And BlueJays Beat Report httpstcoOSKdLrsSZ
0,"Jack Nicklaus on his Donald Trump endorsement, Tiger’s future — and a pickleball injury  https://t.co/gdfnRPE873",Jack Nicklaus Donald Trump endorsement Tiger future pickleball injury httpstcogdfnRPE
0,Mancini is out here feeling it!,Mancini feeling
0,@YankeesWFAN If memory serves….Toonces drove the season off a cliff,YankeesWFAN If memory drove season cliff
0,"Life, liberty, and the pursuit of a #Tigers win.  https://t.co/uPzNqW28XU",Life liberty pursuit Tigers win httpstcouPzNqWXU
0,"Kevin Cash said he hasn't narrowed down Tuesday's American League All-Star Game starting pitcher, but that it will be one of the four pitchers voted as starters (Gerrit Cole, Lance Lynn, Carlos Rodon, Shohei Ohtani). #Rays",Kevin Cash said narrowed Tuesdays American League AllStar Game starting pitcher one four pitchers voted starters Gerrit Cole Lance Lynn Carlos Rodon Shohei Ohtani Rays
0,The Blue Jays are doing what they need to do  https://t.co/x4UB8JnUAq,The Blue Jays need httpstcoxUBJnUAq
0,First day building up to long toss👊🏾💨  https://t.co/0w22jVd9sj,First day building long httpstcowjVdsj
0,Squad.  https://t.co/vgmltl2Gvq,Squad httpstcovgmltlGvq
0,Sunday 7: N’Keal Harry could still have role with Patriots  https://t.co/smCUD3drwF,Sunday N Keal Harry could still role Patriots httpstcosmCUDdrwF
0,#Pirates Lineup 08/26/21  1. Ben Gamel LF 2. Michael Chavis 2B 3. Bryan Reynolds CF 4. Colin Moran 1B 5. Wilmer Difo 3B 6. Gregory Polanco RF 7. Kevin Newman SS 8. Michael Perez C 9. Mitch Keller P  Starting Pitcher : Mitch Keller,Pirates Lineup Ben Gamel LF Michael Chavis B Bryan Reynolds CF Colin Moran B Wilmer Difo B Gregory Polanco RF Kevin Newman SS Michael Perez C Mitch Keller P Starting Pitcher Mitch Keller
0,@Big_Time_Atl @baseball_ref Last night's win moved them up to .1,BigTimeAtl baseballref Last nights win moved
0,Opinion: Wildfires don’t only destroy land and towns — they can also ruin firefighters’ health  https://t.co/Y72FH3wV6d,Opinion Wildfires destroy land towns also ruin firefighters health httpstcoYFHwVd
0,Stephen Piscotty understood the assignment  #RiseAndGrind  https://t.co/yenLBPdx2F,Stephen Piscotty understood assignment RiseAndGrind httpstcoyenLBPdxF
0,"If a game is canceled and can't be rescheduled within the current 18-week schedule due to a Covid outbreak, neither team’s players will receive their weekly salary.",If game canceled rescheduled within current week schedule due Covid outbreak neither team players receive weekly salary
0,"Derek Shelton on expectations for Max Kranick: ""No expectations for a homer. Just throw strikes. I'll take a homer if he wants to hit one.""",Derek Shelton expectations Max Kranick No expectations homer Just throw strikes I take homer wants hit one
0,TODAY on @MLBNetworkRadio:  https://t.co/7pJWPsZhpi,TODAY MLBNetworkRadio httpstcopJWPsZhpi
0,O’Neill’s back for a Waino-Cueto game ✌🏼 #STLCards  https://t.co/th5zFZfXub,O Neill back WainoCueto game STLCards httpstcothzFZfXub
0,"Pirates Promote Santiago Florez to Greensboro, Jack Herman to Bradenton #Pirates  https://t.co/d5lwNJ1F9V",Pirates Promote Santiago Florez Greensboro Jack Herman Bradenton Pirates httpstcodlwNJFV
0,@jasoncarreira I'm not at liberty or justice to say,jasoncarreira I liberty justice say
0,Bobby Dalbec is in as a defensive replacement for Marwin Gonzalez at first base. Gonzalez grounded out last inning.,Bobby Dalbec defensive replacement Marwin Gonzalez first base Gonzalez grounded last inning
0,Relatedly: I am not looking forward to the day I accidentally say Norman Golan ala Lade WeBlanc   @jmjones,Relatedly I looking forward day I accidentally say Norman Golan ala Lade WeBlanc jmjones
0,And now he's been promoted to Double-A Arkansas.,And promoted DoubleA Arkansas
0,"Willson Contreras now playing 3B, Sogard pitching, Gushue catching, Pederson at 1B.",Willson Contreras playing B Sogard pitching Gushue catching Pederson B
0,"The #Brewers notes provided by @MikeVassallo13 give us this interesting tidbit: During the 10-game winning streak, team has plus-47 run differential (73-26). Prior to that, it was minus-7 (291-298) for the entire season.",The Brewers notes provided MikeVassallo give us interesting tidbit During game winning streak team plus run differential Prior minus entire season
0,@jokeylocomotive @clylealt  https://t.co/IWLzN9GyZc,jokeylocomotive clylealt httpstcoIWLzNGyZc
0,"Plan is for Spencer Howard to work as a starter in triple-A. No timetable for his return. Howard said he views the move as a long-term benefit to help finish off his development, specifically to improve his offspeed pitches.",Plan Spencer Howard work starter tripleA No timetable return Howard said views move longterm benefit help finish development specifically improve offspeed pitches
0,Rehabbing @SFGiants third baseman Evan Longoria belts a robust homer for the @RiverCats.  https://t.co/lmQ4Rw9LJ8,Rehabbing SFGiants third baseman Evan Longoria belts robust homer RiverCats httpstcolmQRwLJ
0,#Dodgers are recalling Brusdar Graterol to take Bauer's spot on the roster during his time on administrative leave.,Dodgers recalling Brusdar Graterol take Bauers spot roster time administrative leave
0,BIG MEN UPFRONT - AND DAK UPRIGHT  Can #Cowboys Tackles Stay Healthy - To Keep #DakPrescott Healthy?  https://t.co/EO8GUkLvnh - @BlitzcastNFL,BIG MEN UPFRONT AND DAK UPRIGHT Can Cowboys Tackles Stay Healthy To Keep DakPrescott Healthy httpstcoEOGUkLvnh BlitzcastNFL
0,Hoy Park reportedly is headed to the big leagues.,Hoy Park reportedly headed big leagues
0,On @SoxProspects News: Podcast Ep. #223: Yorke moving up  https://t.co/MA4voNRpZg,On SoxProspects News Podcast Ep Yorke moving httpstcoMAvoNRpZg
0,"Broncos podcast: Breaking down preseason finale against Rams, Courtland Sutton and Von Miller’s return, special teams and more  https://t.co/2JxbOAdQcz",Broncos podcast Breaking preseason finale Rams Courtland Sutton Von Miller return special teams httpstcoJxbOAdQcz
0,Seahawks could legit finish last this season  https://t.co/L9Jne3cIFd  https://t.co/LpeWN8NsfI,Seahawks could legit finish last season httpstcoLJnecIFd httpstcoLpeWNNsfI
0,WHAT A RETURN,WHAT A RETURN
0,Good to see in the #Rays minor league notes that Brendan McKay is to pitch tomorrow in the Florida Complex League.,Good see Rays minor league notes Brendan McKay pitch tomorrow Florida Complex League
0,I’ve got Sandy Koufax trying to get on against Anthony Reyes lol,I got Sandy Koufax trying get Anthony Reyes lol
0,"Right-hander Andrew McInvale is minor-leaguer going to #Marlins with Joe Panik in #BlueJays trade for reliever Adam Cimber and outfielder Corey Dickerson, per multiple industry sources",Righthander Andrew McInvale minorleaguer going Marlins Joe Panik BlueJays trade reliever Adam Cimber outfielder Corey Dickerson per multiple industry sources
0,🚨New pod🚨 The #Astros split the series vs. #Dodgers   after Jake Odorizzi gives up 4 homers. @EricTalksStros and @HtownWheelhouse discuss on @LockedOnAstros podcast ⚾️ Correa takes Joe Kelly deep ⚾️ Altuve strikes out a lot 🎧  https://t.co/cTQ81ICpZY 🎥  https://t.co/nOMJ4pEeTn  https://t.co/TjzaJcmJ95,The Astros split series vs Dodgers Jake Odorizzi gives homers EricTalksStros HtownWheelhouse discuss LockedOnAstros podcast Correa takes Joe Kelly deep Altuve strikes lot httpstcocTQICpZY httpstconOMJpEeTn httpstcoTjzaJcmJ
0,Weird things that Tony La Russa does: Uses Zack Collins as a pinch-hitter.,Weird things Tony La Russa Uses Zack Collins pinchhitter
0,"The Padres promoted righty reliever James Norwood. He made 23 appearances with the Cubs from 2018-20. In 17 innings with El Paso, he posted 29 strikeouts and seven walks.",The Padres promoted righty reliever James Norwood He made appearances Cubs In innings El Paso posted strikeouts seven walks
0,"After missing three weeks, Nick Castellanos was back in the Reds lineup.  https://t.co/GWaZRUB7kG",After missing three weeks Nick Castellanos back Reds lineup httpstcoGWaZRUBkG
0,I’m told the Diamondbacks are promoting recently acquired pitcher Keegan Curtis to Triple-A. Had been pitching for Somerset before the Yankees traded him.,I told Diamondbacks promoting recently acquired pitcher Keegan Curtis TripleA Had pitching Somerset Yankees traded
0,"Should be able to get more, Stephen, but not dealing from a position of strength.",Should able get Stephen dealing position strength
0,vintage @AShinyashiki9 #Rapids96 @DenverChannel --&gt;,vintage AShinyashiki Rapids DenverChannel gt
0,Well that was an inch or two away from a catastrophe,Well inch two away catastrophe
0,3 Tigers prospects on this list,Tigers prospects list
0,Jon Gray is the pinch runner. He did this earlier this season when Kyle Freeland had to be removed,Jon Gray pinch runner He earlier season Kyle Freeland removed
0,@ChrisLee1515 Stopped hurting for a while but then I did like 4 reps of shoulder press and couldn’t get it up after and it’s been a dull pain since  Somethings definitely wrong lol,ChrisLee Stopped hurting I like reps shoulder press get dull pain since Somethings definitely wrong lol
0,Live look at Scott Foster in the referees locker room  https://t.co/StBwKDa9I2,Live look Scott Foster referees locker room httpstcoStBwKDaI
0,"Sal Perez took an at-bat as a pinch hitter late in today's game. Mike Matheny said had they had the DH, Salvy ""possibly"" could have been in the lineup. They were playing in the NL ballpark.",Sal Perez took atbat pinch hitter late todays game Mike Matheny said DH Salvy possibly could lineup They playing NL ballpark
0,"After #ResilientSF pulled off another comeback victory, check out @giantprospectiv latest piece on #SFGiants 11th round draft pick Donovan McIntyre. Selected out of Marian Catholic HS (IL), McIntyre chatted with Wrenzie about his path to pro baseball.  https://t.co/xb2nDch0xO",After ResilientSF pulled another comeback victory check giantprospectiv latest piece SFGiants th round draft pick Donovan McIntyre Selected Marian Catholic HS IL McIntyre chatted Wrenzie path pro baseball httpstcoxbnDchxO
